标题,来源,下载方式,链接
2022 USPSTF建议声明：在有心血管危险因素的成人中提倡健康饮食和体育活动预防心血管疾病的行为咨询干预,"美国预防医学工作组(USPSTF,U.S. Preventive Services Task Force)",有其他版本第三方数据库下载,https://guide.medlive.cn/guideline/26372
血管紧张素受体‑脑啡肽酶抑制剂在心力衰竭患者中应用的中国专家共识,中华医学会心血管病学分会(Chinese Society of Cardiology),会员可通过APP阅读,https://guide.medlive.cn/guideline/26410
子宫内膜息肉临床诊疗路径,妇产科相关专家组（统称）,会员可通过APP阅读,https://guide.medlive.cn/guideline/26482
子宫颈低级别鳞状上皮内病变管理的中国专家共识,"中国优生科学协会阴道镜和宫颈病理学分会(CSCCP,Chinese Society for Colposcopy and Cervical Pathology of China Healthy Birth Science Association)",站内免费下载,https://guide.medlive.cn/guideline/26366
氨基酮戊酸光动力疗法在女性下生殖道疾病的临床应用专家共识,妇产科相关专家组（统称）,站内免费下载,https://guide.medlive.cn/guideline/26364
腹腔内补片修补术中国专家共识（2022版）,中华医学会外科学分会疝和腹壁外科学组,站内免费下载,https://guide.medlive.cn/guideline/26367
卵巢恶性肿瘤保留生育功能的中国专家共识（2022年版）,"中国优生科学协会(CHBSA,China Healthy Birth Science Association)",站内免费下载,https://guide.medlive.cn/guideline/26369
2022 昆士兰临床指南：更安全的婴儿睡眠（V1）,"昆士兰卫生组织(QLD,Queensland Health)",站内免费下载,https://guide.medlive.cn/guideline/26584
中国儿童腹腔感染诊治专家共识,国家儿童健康与疾病临床医学研究中心,会员可通过APP阅读,https://guide.medlive.cn/guideline/26411
女性慢性心力衰竭管理的中国专家共识,中华医学会心血管病学分会(Chinese Society of Cardiology),会员可通过APP阅读,https://guide.medlive.cn/guideline/26412
鼻腔盐水冲洗预防新型冠状病毒感染专家共识,中国鼻病研究协作组,有其他版本站内免费下载,https://guide.medlive.cn/guideline/26391
2022 AUA/ASTRO指南：临床局限性前列腺癌—第2部分：主动监测原则、手术原则和随访,"美国泌尿外科学会(AUA,American Urological Association)",有其他版本第三方数据库下载,https://guide.medlive.cn/guideline/26443
2022 AUA/ASTRO指南：临床局限性前列腺癌—第1部分：介绍，风险评估，分期以及基于风险的管理,"美国泌尿外科学会(AUA,American Urological Association)",有其他版本第三方数据库下载,https://guide.medlive.cn/guideline/26442
2022 国际脂质专家小组意见书：红曲米用于血脂异常和心血管风险的降低,国外心血管相关专家小组（统称）,站内免费下载,https://guide.medlive.cn/guideline/26436
运动相关心血管事件风险的评估与监测中国专家共识,"中国医药卫生文化协会(CHCA,China Health Culture Association)",站内免费下载,https://guide.medlive.cn/guideline/26379
中国胃癌筛查与早诊早治指南（2022，北京）,中国胃癌筛查与早诊早治指南制定专家组,站内免费下载,https://guide.medlive.cn/guideline/26395
孕产期甲状腺疾病防治管理指南,«孕产期甲状腺疾病防治管理指南»编撰委员会,有解读会员可通过APP阅读,https://guide.medlive.cn/guideline/26377
中药通心络防治急性ST段抬高型心肌梗死心肌无再流中国专家共识（2022年）,国家中医药管理局重大疑难疾病（急性心肌梗死）中西医临床协作试点项目组,站内免费下载,https://guide.medlive.cn/guideline/26365
2021 中国指南：儿科超说明书用药管理（英文版）,中国儿科相关医学专家组（统称）,站内免费下载,https://guide.medlive.cn/guideline/26371
2022 PANCCO临床实践指南：成人溃疡性结肠炎的治疗（更新版）,"泛美克罗恩病和结肠炎组织(PANCCO,Pan American Crohn´s and Colitis Organisation)",站内免费下载,https://guide.medlive.cn/guideline/26370
2022 ABN共识指南：多发性硬化与感染风险,"英国神经病医师协会(ABN,Association of British Neurologists)",站内免费下载,https://guide.medlive.cn/guideline/26358
2022 SFORL指南：药物诱导睡眠内镜在成人阻塞性睡眠呼吸暂停综合征中的应用,"法国耳鼻喉科学会(SFORL,French Society of Otorhinolaryngology)",站内免费下载,https://guide.medlive.cn/guideline/26357
2022 SCMR专家共识声明：后天性和非结构性儿童心脏病的心血管磁共振检查,"美国心血管核磁共振成像协会(SCMR,Society for Cardiovascular Magnetic Resonance)",站内免费下载,https://guide.medlive.cn/guideline/26347
肺部多发磨玻璃结节中西医结合防治一体化专家共识,上海市医师协会整合医学分会,站内免费下载,https://guide.medlive.cn/guideline/26506
产前和产时电子胎心监护临床实践专家共识,中国妇幼保健协会,站内免费下载,https://guide.medlive.cn/guideline/26355
肠杆菌目细菌碳青霉烯酶的实验室检测和临床报告规范专家共识（第二版）,中国感染病相关专家组（统称）,有其他版本站内免费下载,https://guide.medlive.cn/guideline/26636
终止癫痫持续状态发作的专家共识,"中国抗癫痫协会(CAAE,China Association Against Epilepsy)",站内免费下载,https://guide.medlive.cn/guideline/26353
埋线提升术操作专家共识之强生鱼骨线／螺旋线操作共识(2022年版),中国整形美容协会,有其他版本站内免费下载,https://guide.medlive.cn/guideline/26430
2022 SICVE指南：颈动脉手术预防卒中（更新版）,"意大利血管和血管内外科学会(SICVE,Italian Society of Vascular and Endovascular Surgery)",站内免费下载,https://guide.medlive.cn/guideline/26359
先天性右室双出口新解剖分型超声心动图诊断规范专家共识,中国超声医学工程学会,站内免费下载,https://guide.medlive.cn/guideline/26348
肺癌姑息治疗中国专家共识,中国临床肿瘤学会肿瘤支持与康复治疗专家委员会,会员可通过APP阅读,https://guide.medlive.cn/guideline/26423
2022 SBC指南：心肌炎,"巴西心脏协会(SBC,Brazilian Society of Cardiology)",站内免费下载,https://guide.medlive.cn/guideline/26360
2022 AAES指南：继发性和三发性肾性甲状旁腺功能亢进的明确手术治疗,"美国内分泌外科协会(AAES,American Association of Endocrine Surgeons)",有解读站内免费下载,https://guide.medlive.cn/guideline/26597
2022 HKUA/HKSUO共识声明：基因检测及其在前列腺癌治疗中的临床应用,"香港泌尿外科协会(HKUA,Hong Kong Urological Association)",站内免费下载,https://guide.medlive.cn/guideline/26454
2022 AHA科学声明：心血管疾病多基因风险评分,"美国心脏协会(AHA,American Heart Association)",第三方数据库下载,https://guide.medlive.cn/guideline/26361
2022 国际共识：肱骨近端骨折核心影像学监测协议,国外骨科相关专家小组（统称）,站内免费下载,https://guide.medlive.cn/guideline/26375
2022 ILAE共识建议：评估癫痫手术的转诊时机,"国际抗癫痫联盟(ILAE,International League Against Epilepsy)",站内免费下载,https://guide.medlive.cn/guideline/26363
2022 SIGE指南：乳糜泻和疱疹样皮炎的诊断和管理,"意大利胃肠病学和胃肠内镜学会(SIGE,Italian Society of Gastroenterology and Gastrointestinal Endoscopy)",站内免费下载,https://guide.medlive.cn/guideline/26350
手术室静脉血栓栓塞症预防与护理专家共识,北京护理学会,会员可通过APP阅读,https://guide.medlive.cn/guideline/26504
2022 意大利共识：Lennox-Gastaut综合征的管理,国外神经内科相关专家小组（统称）,站内免费下载,https://guide.medlive.cn/guideline/26581
2022 预防性儿童卫生保健建议,"美国儿科学会(AAP,American Academy of Pediatrics)",有其他版本第三方数据库下载,https://guide.medlive.cn/guideline/26441
2022 AIOM意见书：实体瘤患者接种带状疱疹疫苗,"意大利肿瘤医学协会(AIOM,Italian Association of Medical Oncology)",站内免费下载,https://guide.medlive.cn/guideline/26438
2022 国际专家共识：唐氏综合征衰退障碍的评估和诊断,国外神经内科相关专家小组（统称）,站内免费下载,https://guide.medlive.cn/guideline/26425
2022 CRA指南：应用改善病情抗风湿药治疗类风湿性关节炎,"加拿大风湿病学协会(CRA,Canadian Rheumatology Association)",第三方数据库下载,https://guide.medlive.cn/guideline/26388
2022 共识建议：优化非小细胞肺癌新靶向性改变的检测,国外肿瘤科相关专家小组（统称）,站内免费下载,https://guide.medlive.cn/guideline/26373
性发育异常分类与诊断流程专家共识,"中华预防医学会(CPMA,Chinese Preventive Medicine Association)",站内免费下载,https://guide.medlive.cn/guideline/26349
2022 EHA/ISA指南：全身性AL淀粉样变性的非移植化疗,"欧洲血液学协会(EHA,European Haematology Association)",站内免费下载,https://guide.medlive.cn/guideline/26344
2022 KSN建议：低钠血症诊断和治疗中的争议问题,"韩国肾脏病学会(KSN,Korean Society of Nephrology)",站内免费下载,https://guide.medlive.cn/guideline/26440
2022 AHA科学声明：先天性心脏病的心理结局和干预,"美国心脏协会(AHA,American Heart Association)",第三方数据库下载,https://guide.medlive.cn/guideline/26362
2022 EHA指南：癌症患者血小板减少的抗栓治疗管理,"欧洲血液学协会(EHA,European Haematology Association)",第三方数据库下载,https://guide.medlive.cn/guideline/26453
2022 I-CARE共识声明：小肠胶囊内镜下萎缩性病变的命名和定义,"国际胶囊内镜研究小组(I-CARE,International CApsule endoscopy REsearch Group)",站内免费下载,https://guide.medlive.cn/guideline/26382
2022 BSE共识声明：成人经胸超声心动图的临床适应证和分诊,"英国超声心动图学会(BSE,British Society of Echocardiography)",站内免费下载,https://guide.medlive.cn/guideline/26317
2022 ACPGBI/BSG指南：具有疑似结直肠癌症状和体征患者的粪便免疫化学检测,"大不列颠及爱尔兰肛肠协会(ACPGBI,Association of Coloproctology of Great Britain and Ireland)",站内免费下载,https://guide.medlive.cn/guideline/26314
2022 HKUA/HKSUO共识声明：晚期和转移性肾细胞癌的治疗建议,"香港泌尿外科协会(HKUA,Hong Kong Urological Association)",有其他版本站内免费下载,https://guide.medlive.cn/guideline/26294
2022 痛风和高尿酸血症患者的营养和生活方式建议（更新版）,国外风湿免疫科相关专家小组,站内免费下载,https://guide.medlive.cn/guideline/26318
2022 SIGE/SIED指南：幽门螺杆菌感染的管理,"意大利胃肠病学和胃肠内镜学会(SIGE,Italian Society of Gastroenterology and Gastrointestinal Endoscopy)",站内免费下载,https://guide.medlive.cn/guideline/26326
早产儿呼吸暂停诊治专家共识（2022版）,中华医学会儿科学分会新生儿学组,站内VIP下载,https://guide.medlive.cn/guideline/26329
简化式左心耳封堵术临床路径中国专家共识（2022）,"中国医师协会心血管内科医师分会(CCCP,Chinese College of Cardiovascular Physicians)",会员可通过APP阅读,https://guide.medlive.cn/guideline/26445
2022 SITC临床实践指南：非黑色素瘤皮肤癌的免疫治疗,"肿瘤免疫治疗学会(SITC,Society for Immunotherapy of Cancer)",站内免费下载,https://guide.medlive.cn/guideline/26403
多发性骨髓瘤骨病外科治疗专家共识（2022版）,中国抗癌协会骨肿瘤和骨转移瘤专业委员会,有其他版本站内免费下载,https://guide.medlive.cn/guideline/26300
乳腺癌骨转移临床诊疗专家共识,中国抗癌协会骨肿瘤和骨转移瘤专业委员会,站内免费下载,https://guide.medlive.cn/guideline/26299
2022 EACVI临床共识：自身免疫性风湿性疾病的心血管磁共振检查,"欧洲协会心血管影像协会(EACVI,European Association of Cardiovascular Imaging)",第三方数据库下载,https://guide.medlive.cn/guideline/26291
2022 中国专家共识：危重症患者的血糖管理（英文版）,国内急诊/重症相关专家小组（统称）,站内免费下载,https://guide.medlive.cn/guideline/26683
2022 ISTH指南：COVID-19的抗栓治疗,"国际血栓与止血学会(ISTH,International Society on Thrombosis and Haemostasis)",站内免费下载,https://guide.medlive.cn/guideline/26402
2021 日本临床实践指南：急性呼吸窘迫综合征（ARDS）,"日本呼吸学会(JRS,the Japanese Respiratory Society)",站内免费下载,https://guide.medlive.cn/guideline/26288
2022 ADA共识报告：心力衰竭——被低估的糖尿病并发症,"美国糖尿病学会(ADA,American Diabetes Association)",第三方数据库下载,https://guide.medlive.cn/guideline/26284
2022更新—2014 NICE指南：成人肺炎的诊断和管理（CG.191）,"英国国家卫生与临床优化研究所 (NICE,National Institute for Health and Clinical Excellence)",有其他版本站内免费下载,https://guide.medlive.cn/guideline/26301
2022 BSG指南：功能性消化不良的管理,"英国胃肠病学会(BSG,British Society of Gastroenterology)",站内免费下载,https://guide.medlive.cn/guideline/26285
2022 亚洲临床建议：转甲状腺素蛋白淀粉样变心肌病患者的诊断和监测,亚洲心血管专家小组（统称）,站内免费下载,https://guide.medlive.cn/guideline/26282
中国肿瘤心脏病患者新辅助化疗后麻醉管理专家共识（2021版）,中国抗癌协会肿瘤麻醉与镇痛专业委员会,站内免费下载,https://guide.medlive.cn/guideline/26279
2022 EAN/MDS指南：帕金森病的治疗-I. 侵入性治疗,"欧洲神经病学学会(EAN,European Academy of Neurology)",有其他版本站内免费下载,https://guide.medlive.cn/guideline/26270
慢性阻塞性肺疾病免疫调节治疗专家共识,《慢性阻塞性肺疾病免疫调节治疗专家共识》撰写组,站内免费下载,https://guide.medlive.cn/guideline/26259
婴幼儿功能性消化不良综合征诊断共识,中国中药协会儿童健康与药物研究专业委员会消化学组,会员可通过APP阅读,https://guide.medlive.cn/guideline/26289
2022 循证临床实践指南：1岁以下中心性发育性髋关节发育不良的治疗-第1部分,国外骨科相关专家小组（统称）,站内免费下载,https://guide.medlive.cn/guideline/26419
剖宫产术后加速康复麻醉实践专家共识,中国妇幼保健协会麻醉专业委员会,站内免费下载,https://guide.medlive.cn/guideline/26260
2022 SUR共识会议建议：偶然发现胆囊息肉的管理,"超声放射医师学会(SRU,Society of Radiologists in Ultrasound)",第三方数据库下载,https://guide.medlive.cn/guideline/26269
2022 EAU指南：泌尿系肿瘤综合征的种系检测,"欧洲泌尿外科学会(EAU,European Association of Urology)",第三方数据库下载,https://guide.medlive.cn/guideline/26293
不明原因儿童严重急性肝炎中西医诊疗专家指导建议,中华中医药学会肝胆病分会,站内免费下载,https://guide.medlive.cn/guideline/26447
2022 国际回肠贮袋协会共识指南：贮袋肿瘤形成的管理,国际回肠贮袋协会(International Ileal Pouch Consortium),站内免费下载,https://guide.medlive.cn/guideline/26303
2022 SOGC临床实践指南：双绒毛膜双胎妊娠的管理（No.428）,"加拿大妇产科医生协会(SOGC,Society of Obstetricians and Gynaecologists of Canada)",有解读站内免费下载,https://guide.medlive.cn/guideline/26290
国家基层糖尿病防治管理手册（2022）,"中华医学会糖尿病学分会(CDS,Chinese Diabetes Society)",有其他版本会员可通过APP阅读,https://guide.medlive.cn/guideline/26250
推拿治疗儿童厌食症循证临床实践指南（2021版）,广东省中医药学会,站内免费下载,https://guide.medlive.cn/guideline/26267
成人肺功能诊断规范中国专家共识,中国呼吸科专家组（统称）,站内免费下载,https://guide.medlive.cn/guideline/26248
2022 ASMBS共识声明：腹腔镜下可调节胃束带管理,"美国代谢和减肥外科学会(ASMBS,American Society for Metabolic & Bariatric Surgery)",站内免费下载,https://guide.medlive.cn/guideline/26579
中国低龄儿童孤独症谱系障碍早期诊断专家共识,中华医学会儿科学分会,会员可通过APP阅读,https://guide.medlive.cn/guideline/26238
妊娠期乳腺癌患者生育力保护专家共识,中国人体健康科技促进会,站内免费下载,https://guide.medlive.cn/guideline/26249
2022 JSH临床实践指南：自身免疫性肝炎,"日本肝脏学会(JSH,The Japan Society of Hepatology)",站内免费下载,https://guide.medlive.cn/guideline/26268
2022 国际临床实践指南：癌症（包括COVID-19）患者静脉血栓栓塞的治疗和预防,"国际血栓形成和癌症创议(ITAC-CME,International Initiative on Thrombosis and Cancer)",有解读有翻译第三方数据库下载,https://guide.medlive.cn/guideline/26237
结核病免疫治疗专家共识（2022年版）,中华医学会结核病学分会,有解读会员可通过APP阅读,https://guide.medlive.cn/guideline/26225
儿童哮喘中医诊疗指南（修订）,中医相关专家组（统称）,站内免费下载,https://guide.medlive.cn/guideline/26481
2022 NAMS立场声明：激素治疗,"北美绝经学会(NAMS,The North American Menopause Society)",有其他版本站内免费下载,https://guide.medlive.cn/guideline/26351
猴痘防控技术指南（2022年版）,中华人民共和国国家卫生健康委员会,站内免费下载,https://guide.medlive.cn/guideline/26328
2022 意大利多学会共识建议：成人慢性咳嗽,国外呼吸科专家组（统称）,站内免费下载,https://guide.medlive.cn/guideline/26252
2022 意大利共识：儿童银屑病的管理（更新版）,国外风湿免疫科相关专家小组,站内免费下载,https://guide.medlive.cn/guideline/26236
2022 AGA临床实践指南：腹泻型肠易激综合征的药物治疗,"美国胃肠病协会(AGA,American Gastroenterological Association)",第三方数据库下载,https://guide.medlive.cn/guideline/26231
2022 AGA临床实践指南：便秘型肠易激综合征的药物治疗,"美国胃肠病协会(AGA,American Gastroenterological Association)",第三方数据库下载,https://guide.medlive.cn/guideline/26230
2021 EULAR/ACR指南：白细胞介素-1介导的自身炎症性疾病的诊断和管理,"欧洲抗风湿病联盟(EULAR,The European League Against Rheumatism)",有解读站内免费下载,https://guide.medlive.cn/guideline/28719
2022 意大利多学科指南：成人尿流改道术和造口的手术管理,国外泌尿外科相关专家组（统称）,第三方数据库下载,https://guide.medlive.cn/guideline/27394
依奇珠单抗治疗中重度斑块型银屑病专家共识,中国医疗保健国际交流促进会,站内免费下载,https://guide.medlive.cn/guideline/27204
新型冠状病毒肺炎疫情期间肝癌患者介入治疗管理专家指导意见,中国抗癌协会肿瘤介入专家委员会,站内免费下载,https://guide.medlive.cn/guideline/28113
2型糖尿病早期大血管病变无创性检查的中国专家共识,"中华医学会内分泌学分会(CSE,Chinese Society of Endocrinology)",会员可通过APP阅读,https://guide.medlive.cn/guideline/26325
经皮冠状动脉介入治疗术后血压管理中国专家共识,中国医师协会高血压专业委员会,站内免费下载,https://guide.medlive.cn/guideline/26264
肌萎缩侧索硬化诊断和治疗中国专家共识2022,中华医学会神经病学分会,有其他版本站内VIP下载,https://guide.medlive.cn/guideline/27494
食管裂孔疝修补及抗反流手术规范微共识,中国普通外科相关专家组（统称）,站内免费下载,https://guide.medlive.cn/guideline/27081
2022 BAN实践指南：卒中康复—第Ⅰ部分,"巴西神经病学学会(BAN,Brazilian Academy of Neurology)",有其他版本站内免费下载,https://guide.medlive.cn/guideline/26951
糖尿病分级诊疗转诊制度与转诊标准深圳专家共识,深圳市医防融合代谢性疾病项目组,站内免费下载,https://guide.medlive.cn/guideline/26706
金嗓散结胶囊( 丸) 治疗声带小结、声带息肉临床应用专家共识,"中华中医药学会(CACM,China Association of Chinese Medcine)",站内免费下载,https://guide.medlive.cn/guideline/26718
2022 中国台湾指南：偏头痛的急性发作治疗,"中国台湾头痛学会(THS,Taiwan Headache Society)",有其他版本站内免费下载,https://guide.medlive.cn/guideline/26854
中国肥厚型心肌病指南2022,中国医师协会心力衰竭专业委员会,有其他版本会员可通过APP阅读,https://guide.medlive.cn/guideline/26782
儿童青少年近视防控中医适宜技术临床实践指南（上）,中华中医药学会眼科分会,有其他版本站内免费下载,https://guide.medlive.cn/guideline/26772
慢性脑缺血临床诊治专家共识,中国神经内科相关专家小组（统称）,站内免费下载,https://guide.medlive.cn/guideline/26760
阴茎异常勃起诊断和治疗指南,中华医学会男科学分会,站内免费下载,https://guide.medlive.cn/guideline/26583
方舱医院感染防控专家共识,"中国医院协会(CHA,Chinese Hospital Association)",有其他版本站内免费下载,https://guide.medlive.cn/guideline/26434
类器官药物敏感性检测指导肿瘤精准治疗临床应用专家共识（2022 年版）,类器官药物敏感性检测指导肿瘤精准治疗临床应用专家共识（2022年版）编写专家组,站内免费下载,https://guide.medlive.cn/guideline/26346
ctDNA 高通量测序临床实践专家共识（2022年版）,中国抗癌协会肿瘤标志专业委员会,站内免费下载,https://guide.medlive.cn/guideline/26339
激素敏感性咳嗽诊治上海专家共识,上海市医学会(ShangHai Medical Association),站内免费下载,https://guide.medlive.cn/guideline/26576
中成药临床应用专家共识（第一版）,"中华中医药学会(CACM,China Association of Chinese Medcine)",站内免费下载,https://guide.medlive.cn/guideline/26487
祖国传统医学在慢性阻塞性肺疾病运动康复中应用的专家共识,慢性阻塞性肺疾病运动康复专家共识撰写专家组,站内免费下载,https://guide.medlive.cn/guideline/26451
Stanford B型主动脉夹层诊断和治疗中国专家共识（2022版）,中华医学会外科学分会,站内免费下载,https://guide.medlive.cn/guideline/26450
改良太极功法临床实践指南·脑卒中运动障碍,黑龙江省康复医学会,站内免费下载,https://guide.medlive.cn/guideline/26446
基层医生慢性肾脏病管理中最常见的问题及专家建议,基层医生慢性肾脏病管理建议专家组,站内免费下载,https://guide.medlive.cn/guideline/26356
青霉素类药物更换批号或厂家皮肤试验专家共识,广西药学会循证药学专业委员会,站内免费下载,https://guide.medlive.cn/guideline/26405
肠外营养安全输注专家共识,"中华医学会肠外肠内营养学分会(CSPEN,Chinese Society for Parenteral and Enteral Nutrition)",站内免费下载,https://guide.medlive.cn/guideline/26368
运动联合营养缓解2型糖尿病的专家共识,中国内分泌相关专家小组（统称）,站内免费下载,https://guide.medlive.cn/guideline/26340
中国抗癌协会神经内分泌肿瘤诊治指南（2022年版）,中国抗癌协会神经内分泌肿瘤专业委员会,有其他版本站内免费下载,https://guide.medlive.cn/guideline/26354
2022 多学科指南：脑源性视力损伤的诊断和转诊,国外神经内科相关专家小组（统称）,站内免费下载,https://guide.medlive.cn/guideline/26341
2型糖尿病患者认知功能障碍防治的中国专家共识,"中华医学会内分泌学分会(CSE,Chinese Society of Endocrinology)",会员可通过APP阅读,https://guide.medlive.cn/guideline/26311
鲁拉西酮治疗精神分裂症临床应用专家建议,中国精神科相关专家小组,站内免费下载,https://guide.medlive.cn/guideline/26304
2022 JSMD指南：老年抑郁症的诊断和治疗,"日本心境障碍学会(JSMD,Japanese Society of Mood Disorders)",站内免费下载,https://guide.medlive.cn/guideline/26266
鼻窦炎口服液治疗儿童鼻炎及鼻－鼻窦炎临床应用专家共识,中国医师协会儿科医师分会儿童耳鼻咽喉专业委员会,站内免费下载,https://guide.medlive.cn/guideline/26343
2022 ERKNet共识声明：非梗阻性肾脏发育不良的定义、诊断和临床管理,"欧洲罕见肾病参考网(ERKNet,European Rare Kidney Disease Reference Network)",站内免费下载,https://guide.medlive.cn/guideline/26227
2022 亚洲共识：基础胰岛素起始和滴定实践指导,国外内分泌相关专家小组（统称）,站内免费下载,https://guide.medlive.cn/guideline/26226
低浓度阿托品滴眼液在儿童青少年近视防控中的应用专家共识（2022）,中华医学会眼科学分会,会员可通过APP阅读,https://guide.medlive.cn/guideline/26549
药物过敏诊断和预防方案中国专家共识,中华预防医学会过敏病预防与控制专业委员会,会员可通过APP阅读,https://guide.medlive.cn/guideline/26254
膝关节软骨损伤修复重建指南（2021）,中国膝关节软骨损伤修复重建指南制订工作组,站内免费下载,https://guide.medlive.cn/guideline/26432
2022 EADV指南：大疱性类天疱疮的管理（更新版）,"欧洲皮肤病与性病学会(EADV,European Academy of Dermatology and Venereology)",有其他版本站内免费下载,https://guide.medlive.cn/guideline/26219
