标题,来源,下载方式,链接
特发性肺纤维化急性加重诊断和治疗中国专家共识,中华医学会呼吸病学分会,会员可通过APP阅读,https://guide.medlive.cn/guideline/18655
输卵管妊娠诊治的中国专家共识,"中国优生科学协会(CHBSA,China Healthy Birth Science Association)",站内免费下载,https://guide.medlive.cn/guideline/18451
2019 WFUMB意见书：偶发性肾上腺瘤的管理,"世界医学生物学超声联合会(WFUMB,World Federation for Ultrasound in Medicine and Biology)",站内免费下载,https://guide.medlive.cn/guideline/19572
2019 ETA指南：免疫重建治疗后甲状腺功能不全的管理,"欧洲甲状腺协会(ETA,European Thyroid Association)",站内免费下载,https://guide.medlive.cn/guideline/19053
中国药学会医院药学专业委员会高警示药品推荐目录(2019版),中国药学会,站内免费下载,https://guide.medlive.cn/guideline/19825
肝纤维化中西医结合诊疗指南（2019年版）,"中国中西医结合学会肝病专业委员会(CAIM,chinese association of integrative medcine)",有其他版本站内免费下载,https://guide.medlive.cn/guideline/18443
2018 BASHH指南：生殖器支原体感染的管理,"英国性健康与艾滋病协会(BASHH,British Association for Sexual Health and HIV)",有解读站内免费下载,https://guide.medlive.cn/guideline/18464
2019 欧洲多学科共识指南：基底细胞癌的诊断和治疗,"欧洲皮肤病学论坛(EDF,European Dermatology Forum)",有其他版本站内免费下载,https://guide.medlive.cn/guideline/18462
2017 JCS指南：感染性心内膜炎的预防和治疗,"日本循环学会(JCS,Japanese Circulation Society)",站内免费下载,https://guide.medlive.cn/guideline/18461
2019 APSR立场声明：亚洲COPD的管理,"亚太呼吸病学学会(APSR,Asian Pacific Society of Respirology)",站内免费下载,https://guide.medlive.cn/guideline/18442
2019 BSG指南：胃腺癌风险患者的诊断和管理,"英国胃肠病学会(BSG,British Society of Gastroenterology)",有翻译站内免费下载,https://guide.medlive.cn/guideline/18430
2019 VA/DoD临床实践指南：卒中康复管理,"退伍军人卫生署和美国国防部(VA/DoD,Veterans Health Administration and the US Department of Defense)",有其他版本站内免费下载,https://guide.medlive.cn/guideline/19351
2019 BAP共识声明：失眠，异态睡眠以及昼夜节律睡眠障碍的治疗（更新版）,"英国精神药理协会(BAP,British Association for Psychopharmacology)",站内免费下载,https://guide.medlive.cn/guideline/18435
2019 亚洲乳腺癌协作组共识：亚洲女性绝经前HR+/HER2-乳腺癌的治疗,"亚洲乳腺癌协作组(ABCCG,Asian Breast Cancer Cooperative Group)",站内免费下载,https://guide.medlive.cn/guideline/18445
2019 国际指南：亨廷顿病的治疗,"欧洲亨廷顿病网(EHDN,European Huntington's Disease Network)",站内免费下载,https://guide.medlive.cn/guideline/18525
2019 OARSI指南：膝关节、髋关节和多关节骨关节炎的非手术治疗,"国际骨关节炎研究协会(OARSI,Osteoarthritis Research Society International)",有解读有其他版本站内免费下载,https://guide.medlive.cn/guideline/18446
2018 EULAR建议：大血管血管炎的管理（更新版）,"欧洲抗风湿病联盟(EULAR,The European League Against Rheumatism)",站内免费下载,https://guide.medlive.cn/guideline/18447
2019 ACOG委员会意见：早发型新生儿B族链球菌病的预防（No.782）,"美国妇产科医师学会(ACOG,American College of Obstetricians and Gynecologists)",有其他版本站内免费下载,https://guide.medlive.cn/guideline/18457
2019 SRCA共识声明：常染色体隐性小脑共济失调的分类,"小脑和共济失调研究学会(SRCA,Society for Research on the Cerebellum and Ataxias)",站内免费下载,https://guide.medlive.cn/guideline/18423
2019 NICE指南：疑似神经系统疾病的识别和转诊（NG.127）-更新,"英国国家卫生与临床优化研究所 (NICE,National Institute for Health and Clinical Excellence)",有其他版本站内免费下载,https://guide.medlive.cn/guideline/18419
抗血管生成药物临床不良反应处理手册,"中国临床肿瘤学会(CSCO,Chinese Society of Clinical Oncology)",站内免费下载,https://guide.medlive.cn/guideline/18511
2017 心力衰竭管理药师指南,国外药师专家小组（统称）,第三方数据库下载,https://guide.medlive.cn/guideline/18960
2019 LICAGE意见术：肝硬化患者围手术期止血管理,"欧洲肝脏重症监护组(LICAGE,Liver Intensive Care Group of Europe)",有翻译第三方数据库下载,https://guide.medlive.cn/guideline/19032
2019 AAA临床实践指南：人工耳蜗植入,"美国听力学会(AAA,American Academy of Audiology)",有解读第三方数据库下载,https://guide.medlive.cn/guideline/19736
2019 RA临床实践指南：血液透析,"英国肾脏病协会(UKKA,UK Kidney Association)",有其他版本站内免费下载,https://guide.medlive.cn/guideline/18538
2019 亚洲共识：肠易激综合征（第2版）,亚洲消化科专家小组（统称）,站内免费下载,https://guide.medlive.cn/guideline/18519
2018 KSoLA指南：血脂异常的管理,"韩国脂质和动脉粥样硬化学会(KSoLA,Korean Society of Lipid and Atherosclerosis)",站内免费下载,https://guide.medlive.cn/guideline/18431
预防性使用质子泵抑制剂及处方精简专家指导意见,广东省药学会,站内免费下载,https://guide.medlive.cn/guideline/18407
2019 ACOG实践简报：女性性功能障碍（No.213）,"美国妇产科医师学会(ACOG,American College of Obstetricians and Gynecologists)",有解读有其他版本站内免费下载,https://guide.medlive.cn/guideline/18404
2019 AHA科学声明：儿童和成人Fontan循环的评估和管理,"美国心脏协会(AHA,American Heart Association)",站内免费下载,https://guide.medlive.cn/guideline/18399
2019 NARC共识报告：心血管临床试验中药物不依从报告，解释和分析的标准分类和框架,"不遵医嘱学术研究联盟(NARC,Non-adherence Academic Research Consortium)",站内免费下载,https://guide.medlive.cn/guideline/18393
2018 AIOM指南：转移性非小细胞肺癌的治疗,"意大利肿瘤医学协会(AIOM,Italian Association of Medical Oncology)",站内免费下载,https://guide.medlive.cn/guideline/18410
2018 AIMO指南：肾癌患者的管理,"意大利肿瘤协会(AIMO,Associazione Italiana di Oncologia Medica)",站内免费下载,https://guide.medlive.cn/guideline/18417
2019 HFSA/SAEM/ISHLT临床专家共识：接受心室辅助装置治疗患者的急诊管理,"美国心衰学会(HFSA,HEART FAILURE SOCIETY OF AMERICA)",站内免费下载,https://guide.medlive.cn/guideline/18437
2019 SOGC临床实践指南：剖宫产术后阴道试产（No.382）,"加拿大妇产科医生协会(SOGC,Society of Obstetricians and Gynaecologists of Canada)",站内免费下载,https://guide.medlive.cn/guideline/18548
性发育异常的儿科内分泌诊断与治疗共识,中华医学会儿科学分会内分泌遗传代谢学组,会员可通过APP阅读,https://guide.medlive.cn/guideline/18495
复方氨基酸注射液临床应用专家共识,"中华医学会肠外肠内营养学分会(CSPEN,Chinese Society for Parenteral and Enteral Nutrition)",有其他版本站内VIP下载,https://guide.medlive.cn/guideline/20049
乌司奴单抗治疗斑块型银屑病专家指导建议,中国皮肤性病相关专家小组（统称）,站内免费下载,https://guide.medlive.cn/guideline/18981
中轴型脊柱关节炎诊断和治疗的专家共识（2019年版）,"中国研究型医院学会(CRHA,Chinese Research Hospital Association)",有其他版本站内VIP下载,https://guide.medlive.cn/guideline/18897
复方氨基酸注射液临床应用专家共识,"中华医学会肠外肠内营养学分会(CSPEN,Chinese Society for Parenteral and Enteral Nutrition)",有其他版本站内免费下载,https://guide.medlive.cn/guideline/18763
前蛋白转化酶枯草溶菌素Kexin 9型抑制剂在缺血性卒中二级预防中的临床应用专家共识,"中国卒中学会(CSA,Chinese Stroke Association)",站内免费下载,https://guide.medlive.cn/guideline/18753
腰椎后路短节段手术加速康复外科实施流程专家共识,中国骨科相关专家小组（统称）,站内免费下载,https://guide.medlive.cn/guideline/18712
中国糖尿病足防治指南（2019版）（V）,"中华医学会糖尿病学分会(CDS,Chinese Diabetes Society)",有其他版本会员可通过APP阅读,https://guide.medlive.cn/guideline/18700
无偿献血者免疫细胞资源库专家共识,"中国研究型医院学会(CRHA,Chinese Research Hospital Association)",站内免费下载,https://guide.medlive.cn/guideline/18687
中国妇女孕前肥胖合并血脂异常的诊治路径,中国妇女孕前肥胖诊治路径专家委员会,站内免费下载,https://guide.medlive.cn/guideline/18670
穴位刺激防治术后恶心呕吐专家指导意见,"中国中西医结合学会(CAIM,Chinese Association of Integrative Medicine)",站内免费下载,https://guide.medlive.cn/guideline/18634
MS/MS技术在新生儿氨基酸、有机酸及脂肪酸氧化代谢障碍性疾病筛查中的应用共识,中国医师协会检验医师分会,站内免费下载,https://guide.medlive.cn/guideline/18611
精索静脉曲张手术治疗安全共识,中国医促会泌尿健康促进分会,站内免费下载,https://guide.medlive.cn/guideline/18603
剖宫产术后瘢痕子宫孕妇中期妊娠引产的专家共识,中华医学会计划生育学分会,会员可通过APP阅读,https://guide.medlive.cn/guideline/18585
儿童胰胆管合流异常临床实践专家共识,中华医学会儿科学分会新生儿学组,站内免费下载,https://guide.medlive.cn/guideline/18571
溶血指数质量指标建立与标本管理专家共识,中国医师协会检验医师分会,站内免费下载,https://guide.medlive.cn/guideline/18563
胎儿生长受限专家共识（2019版）,中华医学会围产医学分会胎儿医学学组,会员可通过APP阅读,https://guide.medlive.cn/guideline/18557
心血管植入型电子器械远程随访中国专家共识,中华医学会心电生理和起搏分会,站内VIP下载,https://guide.medlive.cn/guideline/18550
基于无创心输出量测量系统的心脏重症康复专家共识,中国医师协会重症医学医师分会,站内免费下载,https://guide.medlive.cn/guideline/18536
腹股沟疝日间手术规范化流程专家共识（2019 版）,中国日间手术合作联盟,站内VIP下载,https://guide.medlive.cn/guideline/18529
糖尿病周围神经病基层诊治管理专家指导意见（2019年）,"中华医学会(CMA,Chinese Medical Association)",会员可通过APP阅读,https://guide.medlive.cn/guideline/18499
碘难治性分化型甲状腺癌的诊治管理共识（2019年版）,"中国临床肿瘤学会(CSCO,Chinese Society of Clinical Oncology)",站内免费下载,https://guide.medlive.cn/guideline/18498
常规肺功能检查基层指南（2018年）,"中华医学会(CMA,Chinese Medical Association)",会员可通过APP阅读,https://guide.medlive.cn/guideline/18493
原发性腹膜后软组织肉瘤诊治中国专家共识（2019版）,中华医学会外科学分会,站内免费下载,https://guide.medlive.cn/guideline/18487
结直肠癌围手术期营养治疗中国专家共识（2019版）,中华医学会外科学分会,站内免费下载,https://guide.medlive.cn/guideline/18483
锁骨下/颅外椎动脉狭窄的处理：中国专家共识,中国医疗保健国际交流促进会,站内免费下载,https://guide.medlive.cn/guideline/18480
糖尿病足基层筛查与防治专家共识,"中国微循环学会(CMS,Chinese Society of Microcirculation)",站内免费下载,https://guide.medlive.cn/guideline/18473
中国血液透析用血管通路专家共识（第2版）,"中国医院协会(CHA,Chinese Hospital Association)",有其他版本站内免费下载,https://guide.medlive.cn/guideline/18474
胎儿结构性心脏病介入治疗专家指导意见 （2019年制定）,中华医学会儿科学分会心血管学组,站内免费下载,https://guide.medlive.cn/guideline/18441
卤米松乳膏临床应用专家共识,中国中西医结合学会皮肤性病专业委员会,站内免费下载,https://guide.medlive.cn/guideline/18429
中国儿童难治性肺炎呼吸内镜介入诊疗专家共识,中华人民共和国国家卫生健康委员会,站内免费下载,https://guide.medlive.cn/guideline/18428
睾丸扭转诊治安全共识,中国医促会泌尿健康促进分会,站内免费下载,https://guide.medlive.cn/guideline/18422
心电图诊断术语规范化中国专家共识（2019）,全军心血管专业委员会心脏无创检测学组,站内免费下载,https://guide.medlive.cn/guideline/18413
鼻咽癌标志物临床应用专家共识,"中国抗癌协会(CACA,Chinese Anti-cancer Association)",有解读站内免费下载,https://guide.medlive.cn/guideline/18666
《中国心肺复苏专家共识》之腹部提压心肺复苏临床操作指南,"中国研究型医院学会(CRHA,Chinese Research Hospital Association)",站内免费下载,https://guide.medlive.cn/guideline/18501
2019 ANMS/CVSA指南：成人周期性呕吐综合征的管理,"美国神经胃肠病学与动力学会(ANMS,American Neurogastroenterology and Motility Society)",站内免费下载,https://guide.medlive.cn/guideline/18368
2019 韩国临床实践指南：心脏康复,国外心血管相关专家小组（统称）,站内免费下载,https://guide.medlive.cn/guideline/18488
2019 ESC立场声明：围产期心肌病的病理生理学，诊断和管理,"欧洲心脏病学会(ESC,European Society of Cardiology)",有其他版本第三方数据库下载,https://guide.medlive.cn/guideline/18400
2019 ERS声明：急性呼吸衰竭胸部影像学检查,"欧洲呼吸学会(ERS,European Respiratory Society)",站内免费下载,https://guide.medlive.cn/guideline/18382
2019 AHA科学声明：儿童心脏骤停后护理,"美国心脏协会(AHA,American Heart Association)",站内免费下载,https://guide.medlive.cn/guideline/18381
2019 IEHS指南：腹壁疝和腹壁切口疝的内镜治疗（更新版）-A,"国际内镜疝学会(IEHS,International Endohernia Society)",有解读有其他版本站内免费下载,https://guide.medlive.cn/guideline/18380
2019 EADV指南：性病淋巴肉芽肿的管理,"欧洲皮肤病与性病学会(EADV,European Academy of Dermatology and Venereology)",有其他版本站内免费下载,https://guide.medlive.cn/guideline/18391
2017 临床实践指南：成人弥漫性胶质瘤相关癫痫的诊断和治疗（英文版）,"中国抗癫痫协会(CAAE,China Association Against Epilepsy)",有解读站内免费下载,https://guide.medlive.cn/guideline/18367
2019 GESA立场声明：胃肠内镜检查期间应用西甲硅油,"澳大利亚胃肠病学会(GESA,Gastroenterological Seciety of Australia)",站内免费下载,https://guide.medlive.cn/guideline/18370
中国急诊急性心力衰竭单元建设与管理专家共识,中华医学会急诊医学分会,站内免费下载,https://guide.medlive.cn/guideline/18357
中国急性血栓性疾病抗栓治疗共识,中国医药教育协会,站内免费下载,https://guide.medlive.cn/guideline/18352
2019 NICE指南：妊娠期高血压的诊断和管理（NG 133）,"英国国家卫生与临床优化研究所 (NICE,National Institute for Health and Clinical Excellence)",有解读有其他版本站内免费下载,https://guide.medlive.cn/guideline/18342
儿童腺病毒肺炎诊疗规范（2019年版）,中华人民共和国国家卫生健康委员会,站内免费下载,https://guide.medlive.cn/guideline/18354
2019 NICE指南：儿童和青少年抑郁的识别和管理（NG.134）,"英国国家卫生与临床优化研究所 (NICE,National Institute for Health and Clinical Excellence)",站内免费下载,https://guide.medlive.cn/guideline/18347
2018 JES临床指南：免疫点检查抑制剂诱发的内分泌器官免疫相关不良事件的管理,"日本内分泌学会(JES,Japan Endocrine Society)",第三方数据库下载,https://guide.medlive.cn/guideline/18376
2019 CAR临床实践指南：钆基造影剂在肾脏疾病中的应用（更新）,"加拿大放射科医师协会(CAR,Canadian Association of Radiologists)",有其他版本站内免费下载,https://guide.medlive.cn/guideline/18411
2018 EFSUMB指南建议：弹性成像技术在非肝脏器官的应用（更新版）,"欧洲生物医学超声学会联盟(EFSUMB,European Federation of Societies for Ultrasound in Medicine and Biology)",第三方数据库下载,https://guide.medlive.cn/guideline/18420
2019 CUA/CUOG指南：去势抵抗性前列腺癌的管理（草稿）,"加拿大泌尿外科协会(CUA,Canadian Urological Association)",有其他版本第三方数据库下载,https://guide.medlive.cn/guideline/18544
2019 欧洲建议：心脏性猝死多学科管理中综合遗传检测,"欧洲心脏病学会(ESC,European Society of Cardiology)",站内免费下载,https://guide.medlive.cn/guideline/18372
2019 WMS实践指南：急性高原病的预防和治疗（更新版）,"荒野医学协会(WMS,Wilderness Medical Society)",有解读有其他版本站内免费下载,https://guide.medlive.cn/guideline/18378
2019 欧洲特应性皮炎工作组意见书：孕前，妊娠期间以及哺乳期父母特应性皮炎的治疗,欧洲特应性皮炎工作组,站内免费下载,https://guide.medlive.cn/guideline/18385
2019 加拿大卒中最佳实践建议：卒中后情绪，认知和疲劳,"加拿大心脏与卒中基金会(HSFC,Heart and Stroke Foundation of Canada)",有解读有其他版本第三方数据库下载,https://guide.medlive.cn/guideline/18334
2019 ASGE指南：内镜检查在慢性放射性直肠病出血中的作用,"美国胃肠内镜学会(ASGE,American Society for Gastrointestinal Endoscopy)",有解读站内免费下载,https://guide.medlive.cn/guideline/18363
2019 SIOG意见书：老年乳腺癌患者HER2靶向治疗,"国际老年肿瘤学会(SIOG,International Society of Geriatric Oncology)",站内免费下载,https://guide.medlive.cn/guideline/18406
2019 HFA/ESC实践指导：利钠肽浓度的应用,"欧洲心力衰竭协会(HFA,Heart Failure Association)",第三方数据库下载,https://guide.medlive.cn/guideline/19197
2017 KSR指南：疑似外伤性胸腰椎损伤的初步影像学检查,"韩国放射学会(KSR,Korean Society of Radiology)",站内免费下载,https://guide.medlive.cn/guideline/18822
贝丽姿®-注射用交联透明质酸钠凝胶专家共识（2018）,中国整形美容协会,站内免费下载,https://guide.medlive.cn/guideline/18356
改良电休克治疗专家共识（2019版）,中国医师协会神经调控专业委员会,有其他版本站内免费下载,https://guide.medlive.cn/guideline/18336
中国定量CT( QCT) 骨质疏松症诊断指南（2018）,《中国定量CT( QCT) 骨质疏松症诊断指南》工作组,站内免费下载,https://guide.medlive.cn/guideline/18322
2019 Costello综合征临床分型，基因型以及管理指南,国外儿科相关医学专家组（统称）,站内免费下载,https://guide.medlive.cn/guideline/18331
中国专家共识：糖尿病患者骨折风险管理（英文版）,"中华医学会内分泌学分会(CSE,Chinese Society of Endocrinology)",有其他版本站内免费下载,https://guide.medlive.cn/guideline/18330
2019 SOGC临床实践指南：胎盘植入的筛查，诊断和管理（No.383）,"加拿大妇产科医生协会(SOGC,Society of Obstetricians and Gynaecologists of Canada)",站内免费下载,https://guide.medlive.cn/guideline/18341
2019 临床实践建议：儿童血脂异常,国外儿科相关医学专家组（统称）,站内免费下载,https://guide.medlive.cn/guideline/18338
窦性心率震荡临床应用中国专家共识（2019）,《窦性心率震荡临床应用中国专家共识（2019）》编写专家组,站内免费下载,https://guide.medlive.cn/guideline/18398
2019 ICSI卫生保健指南：缺血性卒中的诊断和初级治疗（第12版）,"临床系统改进协会(ICSI,Institute for Clinical Systems Improvement)",有其他版本站内免费下载,https://guide.medlive.cn/guideline/20802
2019 SIR共识指南：经皮影像引导介入治疗患者血栓和出血风险的围术期管理,"介入放射学会(SIR,Society of Interventional Radiology)",站内免费下载,https://guide.medlive.cn/guideline/18337
甘露醇治疗颅内压增高中国专家共识,中华医学会神经外科学分会,会员可通过APP阅读,https://guide.medlive.cn/guideline/18554
2019 昆士兰临床指南：新生儿常规评估,"昆士兰卫生组织(QLD,Queensland Health)",有其他版本站内免费下载,https://guide.medlive.cn/guideline/18339
2018 RCOG指南：妊娠24+0周疑似早产胎膜早破的管理（No.73）,"英国皇家妇产科医师学院(RCOG,Royal College of Obstetricians and Gynaecologists)",站内免费下载,https://guide.medlive.cn/guideline/18298
2019 加拿大共识声明：减重手术后加速康复,国外普通外科相关专家组（统称）,站内免费下载,https://guide.medlive.cn/guideline/18308
2019 实践指南：多发性硬化病变核磁共振检查评估,国外神经内科相关专家小组（统称）,站内免费下载,https://guide.medlive.cn/guideline/18305
2019 临床指南：成人非心脏手术患者围术期血流动力学管理,国外麻醉相关专家组（统称）,第三方数据库下载,https://guide.medlive.cn/guideline/18324
2019 WMS实践指南：中暑（更新版）,"荒野医学协会(WMS,Wilderness Medical Society)",有其他版本站内免费下载,https://guide.medlive.cn/guideline/18328
2019 SFORL指南：儿童耳蜗植入适应证,"法国耳鼻喉科学会(SFORL,French Society of Otorhinolaryngology)",站内免费下载,https://guide.medlive.cn/guideline/18329
2019 JSCCR指南：结直肠癌的治疗,"日本结直肠癌研究学会(JSCCR,Japanese Society for Cancer of the Colon and Rectum)",有其他版本站内免费下载,https://guide.medlive.cn/guideline/18290
2019 EAACI意见书：母乳喂养婴儿非IgE胃肠道过敏的诊断和管理,"欧洲变应性反应与临床免疫学会(EAACI,European Academy of Allergy and Clinical Immunology)",站内免费下载,https://guide.medlive.cn/guideline/18309
2019 WSES指南：急性重症胰腺炎的管理,"世界急诊外科学会(WSES,World Society of Emergency Surgery)",有解读有翻译站内免费下载,https://guide.medlive.cn/guideline/18304
2019 共识指南：黏多糖贮积症IVA型的管理建议,MPS共识委员会,站内免费下载,https://guide.medlive.cn/guideline/18297
2019 ESPN临床实践建议：儿童慢性肾病患者生长激素治疗,"欧洲儿科肾脏病学会(ESPN,European Society for Paediatric Nephrology)",站内免费下载,https://guide.medlive.cn/guideline/18284
2019 KCRNC共识声明：转移性肾细胞癌患者减瘤性肾切除术的作用,"加拿大肾脏肿瘤研究网络(KCRNC,Kidney Cancer Research Network of Canada)",站内免费下载,https://guide.medlive.cn/guideline/18282
2018 JSNC建议：心脏结节病的18-F氟脱氧葡萄糖正电子发射断层成像检查（更新版）,"日本核心脏病学会(JSNC,Japanese Society of Nuclear Cardiology)",有其他版本站内免费下载,https://guide.medlive.cn/guideline/18285
2019 法国临床指南：物理和康复医学中周围运动神经阻滞,"法国麻醉和重症医学学会(SFAR,French Society for Anaesthesia and Intensive Care)",站内免费下载,https://guide.medlive.cn/guideline/18293
2019 KASL临床实践指南：慢性乙型肝炎的管理,"韩国肝脏病研究学会(KASL,Korean Association for the Study of the Liver)",有其他版本站内免费下载,https://guide.medlive.cn/guideline/18265
2019 ESGE指南：食管支架置入治疗良恶性疾病,"欧洲胃肠道内窥镜学会(ESGE,European Society of Gastrointestinal Endoscopy)",有其他版本第三方数据库下载,https://guide.medlive.cn/guideline/18281
肺功能检查报告规范——肺量计检查、支气管舒张试验、支气管激发试验,中国呼吸医师协会肺功能与临床呼吸生理工作委员会,会员可通过APP阅读,https://guide.medlive.cn/guideline/18524
2019专家建议：接受贝伐单抗治疗的卵巢癌和宫颈癌患者高血压的管理,国外肿瘤科相关专家小组（统称）,有解读站内免费下载,https://guide.medlive.cn/guideline/18272
2019 USPSTF建议声明：HIV感染的筛查,"美国预防医学工作组(USPSTF,U.S. Preventive Services Task Force)",有其他版本站内免费下载,https://guide.medlive.cn/guideline/18258
2019 USPSTF建议声明：预防HIV感染的暴露前预防,"美国预防医学工作组(USPSTF,U.S. Preventive Services Task Force)",有其他版本站内免费下载,https://guide.medlive.cn/guideline/18256
2019 昆士兰产科与新生儿临床指南：新生儿黄疸,"昆士兰卫生组织(QLD,Queensland Health)",有其他版本站内免费下载,https://guide.medlive.cn/guideline/18351
2019 ESsCD指南：乳糜泻和其他麸质相关疾病,"欧洲乳糜泻研究学会(ESsCD,European Society for the Study of Coeliac Disease)",站内免费下载,https://guide.medlive.cn/guideline/18306
终末期肝病临床营养指南,"中华医学会肝病学分会(Chinese Society of Hepatology, CMA)",站内免费下载,https://guide.medlive.cn/guideline/18291
2019 CUA指南：神经源性下尿路功能障碍的诊断，管理和监测-概要,"加拿大泌尿外科协会(CUA,Canadian Urological Association)",有其他版本第三方数据库下载,https://guide.medlive.cn/guideline/18277
2019 专家共识声明：经皮冠脉介入治疗中血小板功能基因检测指导P2Y12受体抑制剂治疗,国外心血管相关专家小组（统称）,站内免费下载,https://guide.medlive.cn/guideline/18296
