标题,来源,下载方式,链接
2022 ESMO临床实践指南：降低遗传性乳腺癌-卵巢癌综合征的癌症风险及筛查,"欧洲肿瘤内科学会(ESMO,European Society for Medical Oncology)",第三方数据库下载,https://guide.medlive.cn/guideline/27129
2022 ESMO临床实践指南：转移性结直肠癌的诊断、治疗和随访,"欧洲肿瘤内科学会(ESMO,European Society for Medical Oncology)",有其他版本第三方数据库下载,https://guide.medlive.cn/guideline/27127
2022 WSES指南：急性肠系膜缺血（更新版）,"世界急诊外科学会(WSES,World Society of Emergency Surgery)",有其他版本站内免费下载,https://guide.medlive.cn/guideline/27049
2022 NICE指南：大于16岁人群骨关节炎的诊断和管理（NG.226）,"英国国家卫生与临床优化研究所 (NICE,National Institute for Health and Clinical Excellence)",第三方数据库下载,https://guide.medlive.cn/guideline/27045
2021 日本临床实践指南：十二指肠癌,"日本胃癌学会(JGCA,Japanese Gastric Cancer Association)",站内免费下载,https://guide.medlive.cn/guideline/27040
2022 SBCe共识：发作性偏头痛的预防和治疗—第Ⅱ部分,"巴西头痛学会(SBCe,Brazilian Headache Society)",有其他版本站内免费下载,https://guide.medlive.cn/guideline/27057
NCCN临床实践指南：恶性胸膜间皮瘤（2022.V2）,"美国国家综合癌症网络(NCCN,National Comprehensive Cancer Network)",有其他版本站内免费下载,https://guide.medlive.cn/guideline/27044
2022 共识指南：脑源性视力障碍的临床评估、调查、诊断和初步管理,国外眼科专家协作组（统称）,站内免费下载,https://guide.medlive.cn/guideline/27041
2022 BSE共识建议：先天性心脏病患者全面经胸超声心动图检查,"英国超声心动图学会(BSE,British Society of Echocardiography)",站内免费下载,https://guide.medlive.cn/guideline/27026
2型糖尿病患者泛血管疾病风险评估与管理中国专家共识（2022版）,"中国医师协会心血管内科医师分会(CCCP,Chinese College of Cardiovascular Physicians)",站内免费下载,https://guide.medlive.cn/guideline/27021
2022 KASID临床实践指南：生物制剂治疗中重度克罗恩病,"韩国肠道疾病研究协会(KASID,Korean Association for the Study of Intestinal Diseases)",站内免费下载,https://guide.medlive.cn/guideline/27013
2022 WHO建议：青少年和儿童慢性HCV感染的治疗以及HCV简化服务提供和诊断（更新版）,"世界卫生组织(WHO,The World Health Organization)",站内免费下载,https://guide.medlive.cn/guideline/27296
2022 SBCe共识：发作性偏头痛的预防和治疗—第Ⅰ部分,"巴西头痛学会(SBCe,Brazilian Headache Society)",有其他版本站内免费下载,https://guide.medlive.cn/guideline/27055
中国缺血性卒中和短暂性脑缺血发作二级预防指南2022,中华医学会神经病学分会,有其他版本会员可通过APP阅读,https://guide.medlive.cn/guideline/27019
2022 ISPAD临床实践指南：糖尿病酮症酸中毒和高血糖高渗状态,"国际儿童青少年糖尿病协会(ISPAD,International Society for Pediatric and Adolescent Diabetes)",有其他版本站内免费下载,https://guide.medlive.cn/guideline/27025
2020 日本产科实践指南,"日本妇产科学会(JSOG,Japan Society of Obstetrics and Gynecology)",站内免费下载,https://guide.medlive.cn/guideline/27016
2022 ISPAD临床实践指南：青春期糖尿病,"国际儿童青少年糖尿病协会(ISPAD,International Society for Pediatric and Adolescent Diabetes)",站内免费下载,https://guide.medlive.cn/guideline/27012
中西医结合诊疗血精专家共识,中国中西医结合学会泌尿外科专业委员会,站内免费下载,https://guide.medlive.cn/guideline/27035
体医融合糖尿病运动干预专家共识,"中国微循环学会(CMS,Chinese Society of Microcirculation)",会员可通过APP阅读,https://guide.medlive.cn/guideline/27023
HPV DNA检测应用于健康体检人群子宫颈癌初筛的专家共识,中国医师协会妇产科医师分会,会员可通过APP阅读,https://guide.medlive.cn/guideline/27022
肉芽肿性小叶性乳腺炎中医诊疗专家共识（2021版）,"中华中医药学会(CACM,China Association of Chinese Medcine)",站内免费下载,https://guide.medlive.cn/guideline/27024
儿童小肠镜临床应用管理专家共识,中华医学会儿科学分会消化学组,站内免费下载,https://guide.medlive.cn/guideline/27039
成人肠造口皮肤黏膜分离护理专家共识,"中国研究型医院学会(CRHA,Chinese Research Hospital Association)",站内免费下载,https://guide.medlive.cn/guideline/27010
2022 CRA建议：幼年特发性关节炎相关性葡萄膜炎的筛查，监测和治疗,"加拿大风湿病学协会(CRA,Canadian Rheumatology Association)",第三方数据库下载,https://guide.medlive.cn/guideline/27030
2022 SWAB建议：癌症患者发热性中性粒细胞减少症的诊断和治疗,"荷兰抗生素政策工作组(SWAB,Dutch Working Party on Antibiotic Policy)",站内免费下载,https://guide.medlive.cn/guideline/27029
2022 国际新生儿猝死工作组专家共识声明：床旁超声检查用于新生儿猝死的系统评估,国外儿科相关医学专家组（统称）,站内免费下载,https://guide.medlive.cn/guideline/27003
2022 APSC临床实践声明：体育活动，心肺适应能力和心血管健康—第Ⅰ部分,"亚太心脏病学会(APSC,Asia-Pacific Society of Cardiology)",有解读有其他版本站内免费下载,https://guide.medlive.cn/guideline/27087
2022 APSC临床实践声明：体育活动，心肺适应能力和心血管健康—第Ⅱ部分,"亚太心脏病学会(APSC,Asia-Pacific Society of Cardiology)",有其他版本站内免费下载,https://guide.medlive.cn/guideline/27090
2022 ACVC/ESC共识文件：以急性心血管疾病为表现的癌症患者的评估和管理（第2部分）,"紧急心血管护理协会(ACVC,Association for Acute Cardiovascular Care)",有其他版本第三方数据库下载,https://guide.medlive.cn/guideline/27092
2022 BSG共识：绿色内镜检查,"英国胃肠病学会(BSG,British Society of Gastroenterology)",站内免费下载,https://guide.medlive.cn/guideline/27006
2022 EHRA共识：心脏植入式电子设备患者医疗程序干扰的预防和管理,"欧洲心律学会(EHRA,European Heart Rhythm Association)",第三方数据库下载,https://guide.medlive.cn/guideline/27004
2022 EFSUMB临床实践指南：床旁超声检查-第1部分（心脏和肺）,"欧洲生物医学超声学会联盟(EFSUMB,European Federation of Societies for Ultrasound in Medicine and Biology)",站内免费下载,https://guide.medlive.cn/guideline/27001
2022 韩国指南：息肉切除术后结肠镜监测（修订版）,"韩国胃肠内镜学会(KSGE,Korean Society of Gastrointestinal Endoscopy)",有其他版本站内免费下载,https://guide.medlive.cn/guideline/26985
2022 SVS/AVF/AVLS临床实践指南：下肢静脉曲张的管理—第Ⅰ部分：浅表干返流的双功能超声扫描和治疗,"血管外科学会(SVS,Society for Vascular Surgery)",有其他版本第三方数据库下载,https://guide.medlive.cn/guideline/27476
2022 EHF共识：偏头痛发作有效治疗和曲坦类治疗失败的定义,"欧洲头痛联盟(EHF,European Headache Federation)",站内免费下载,https://guide.medlive.cn/guideline/26983
2022 WSES共识文件：脾外伤非手术治疗患者的随访策略,"世界急诊外科学会(WSES,World Society of Emergency Surgery)",站内免费下载,https://guide.medlive.cn/guideline/26982
2022 荷兰专家共识声明：儿童Brugada综合征的筛查、诊断和随访,国外心血管相关专家小组（统称）,站内免费下载,https://guide.medlive.cn/guideline/26973
2022 ESMO临床实践指南：免疫治疗的毒性管理,"欧洲肿瘤内科学会(ESMO,European Society for Medical Oncology)",有其他版本第三方数据库下载,https://guide.medlive.cn/guideline/27066
认知训练中国指南（2022年版）,中国医师协会神经内科医师分会,有其他版本会员可通过APP阅读,https://guide.medlive.cn/guideline/27005
2022 ACC专家共识：急诊科急性胸痛的评估和处理决策路径,"美国心脏病学会(ACC,American College of Cardiology)",第三方数据库下载,https://guide.medlive.cn/guideline/26987
2022 临床实践指南：儿童癌症患者紧急和延迟化疗引起的恶心呕吐的预防,国外肿瘤科相关专家小组（统称）,站内免费下载,https://guide.medlive.cn/guideline/26977
2022 ERA立场声明：慢性肾脏病在常规临床实践中作为心血管危险因素,"欧洲肾脏学会(ERA,European Renal Association)",第三方数据库下载,https://guide.medlive.cn/guideline/26967
2022 USPSTF建议声明：儿童和青少年抑郁症和自杀风险的筛查,"美国预防医学工作组(USPSTF,U.S. Preventive Services Task Force)",有其他版本第三方数据库下载,https://guide.medlive.cn/guideline/26965
2022 USPSTF建议声明：儿童和青少年焦虑的筛查,"美国预防医学工作组(USPSTF,U.S. Preventive Services Task Force)",第三方数据库下载,https://guide.medlive.cn/guideline/26963
2022 ESTRO/ACROP共识：少转移前列腺癌的放射治疗建议,"欧洲放射肿瘤学学会(ESTRO,European Society of Radiotherapy & Oncology)",站内免费下载,https://guide.medlive.cn/guideline/27091
孕产期与哺乳期妇女锌缺乏症临床防治专家建议,《孕产期与哺乳期妇女锌缺乏症临床防治专家建议》编写专家组,站内免费下载,https://guide.medlive.cn/guideline/26974
2022 意大利共识：湿疹的局部非药物治疗,国外皮肤性病相关专家小组（统称）,第三方数据库下载,https://guide.medlive.cn/guideline/26950
2022 亚太共识：胃肠道疾病中的小肠细菌过度生长,"印度神经胃肠病学与动力学会(INMA,Indian Neurogastroenterology and Motility Association)",站内免费下载,https://guide.medlive.cn/guideline/26949
2022 国际分类共识：肥大细胞增多症及其相关实体,国外皮肤性病相关专家小组（统称）,站内免费下载,https://guide.medlive.cn/guideline/26952
肿瘤患者特殊医学用途配方食品使用指南,国家市场监管重点实验室(肿瘤特医食品),有其他版本站内免费下载,https://guide.medlive.cn/guideline/27152
注射用多种维生素(13) 临床应用专家共识,中国抗癌协会肿瘤营养与支持治疗专业委员会,有其他版本站内免费下载,https://guide.medlive.cn/guideline/27154
亚低温治疗新生儿缺氧缺血性脑病专家共识（2022）,中华医学会儿科学分会新生儿学组,会员可通过APP阅读,https://guide.medlive.cn/guideline/26943
骨关节炎诊疗规范,"中华医学会风湿病学分会(CRA,Chinese Rheumatology Association)",会员可通过APP阅读,https://guide.medlive.cn/guideline/26990
慢性肾脏病合并结核病的治疗专家共识（2022版）,中华医学会结核病学分会,站内VIP下载,https://guide.medlive.cn/guideline/26930
2022 意大利建议：维生素D缺乏的定义、评估和管理,"意大利骨质疏松，骨矿物质代谢好骨病学会(SIOMMMS,Italian Society for Osteoporosis, Mineral Metabolism and Bone Diseases)",站内免费下载,https://guide.medlive.cn/guideline/27259
儿童纵隔恶性肿瘤相关上腔静脉综合征诊断与处理专家共识,中华医学会儿科学分会,会员可通过APP阅读,https://guide.medlive.cn/guideline/26991
抗中性粒细胞胞质抗体相关血管炎诊疗规范,"中华医学会风湿病学分会(CRA,Chinese Rheumatology Association)",会员可通过APP阅读,https://guide.medlive.cn/guideline/26959
稳定期慢性阻塞性肺疾病医药共管专家共识,中国医学装备协会呼吸病学装备技术专业委员会,会员可通过APP阅读,https://guide.medlive.cn/guideline/26953
2022 EASD/ADA共识报告：胰岛素自动给药—益处、挑战和建议,"欧洲糖尿病研究协会(EASD,European Association for the Study of Diabetes)",第三方数据库下载,https://guide.medlive.cn/guideline/26912
2022 WFSBP/ASLM临床指南：基于生活方式的精神卫生保健在抑郁症患者中的应用,"世界生物精神病学会联合会(WFSBP,World Federation of Societies of Biological Psychiatry)",站内免费下载,https://guide.medlive.cn/guideline/26905
2022 荷兰实践指南：慢性肾脏病患者的妊娠意愿和妊娠（概要）,肾脏病相关专家小组（统称）,站内免费下载,https://guide.medlive.cn/guideline/27492
2022 WHO建议：机械性引产,"世界卫生组织(WHO,The World Health Organization)",有其他版本站内免费下载,https://guide.medlive.cn/guideline/27314
中国社区肺结核主动筛查循证指南,中国防痨协会(Chinese Antituberculosis Association),站内免费下载,https://guide.medlive.cn/guideline/26911
婴儿胆汁淤积症诊断与治疗专家共识,中华医学会儿科学分会感染学组,会员可通过APP阅读,https://guide.medlive.cn/guideline/26929
2022 WHO建议：足月或超期妊娠引产术,"世界卫生组织(WHO,The World Health Organization)",有其他版本站内免费下载,https://guide.medlive.cn/guideline/27376
老年人血脂异常管理中国专家共识,老年人血脂异常管理中国专家共识组,会员可通过APP阅读,https://guide.medlive.cn/guideline/26926
便携式肺功能仪原理、质控及临床应用的中国专家共识,中华医学会呼吸病学分会,会员可通过APP阅读,https://guide.medlive.cn/guideline/26981
胃肠间质瘤病理诊断临床实践指南（2022版）,《胃肠间质瘤病理诊断临床实践指南（2022版）》编写专家委员会,会员可通过APP阅读,https://guide.medlive.cn/guideline/26968
NCCN临床实践指南：恶性腹膜间皮瘤（2022.V2）,"美国国家综合癌症网络(NCCN,National Comprehensive Cancer Network)",有其他版本站内免费下载,https://guide.medlive.cn/guideline/26916
2022 意大利建议：成人肌张力障碍的诊断和治疗,"意大利神经病学学会(SIN,Italian Society of Neurology)",站内免费下载,https://guide.medlive.cn/guideline/26939
2022 科学声明：房颤卒中预防（第2部分）,亚洲心血管专家小组（统称）,有其他版本站内免费下载,https://guide.medlive.cn/guideline/27401
2022 循证建议：急性心肌梗死后左室血栓的管理,国外心血管相关专家小组（统称）,站内免费下载,https://guide.medlive.cn/guideline/26971
2022 IDS建议：多发性痣患者数字监测的适应证,"国际皮肤镜学会(IDS,International Dermoscopy Society)",站内免费下载,https://guide.medlive.cn/guideline/27574
2022 AACE临床实践指南：糖尿病综合治疗计划（更新版）,"美国临床内分泌医师学会(AACE,American Association of Clinical Endocrinologists)",有其他版本第三方数据库下载,https://guide.medlive.cn/guideline/26989
2022 ETA指南：儿童甲状腺结节和分化型甲状腺癌的管理,"欧洲甲状腺协会(ETA,European Thyroid Association)",有解读站内免费下载,https://guide.medlive.cn/guideline/26984
2022 CAP/AMP指南：免疫检查点抑制剂治疗的错配修复和微卫星不稳定性检测,"美国病理学家协会(CAP,College of American Pathologists)",第三方数据库下载,https://guide.medlive.cn/guideline/28778
2022 KSH立场声明：家庭血压监测,"韩国高血压学会(KSH,Korean Society of Hypertension)",站内免费下载,https://guide.medlive.cn/guideline/26924
血友病性关节病超声评估专家共识 （2022年版）,中国血友病协作组,站内免费下载,https://guide.medlive.cn/guideline/30690
2022 CPOC指南：围手术期贫血的管理,"围手术期护理中心(CPOC,Centre for Perioperative Care)",第三方数据库下载,https://guide.medlive.cn/guideline/28104
2022 临床实践指南：血管内血栓切除术和静脉注射阿普替酶治疗大血管闭塞性急性缺血性卒中,国际神经内科专家小组（统称）,第三方数据库下载,https://guide.medlive.cn/guideline/27430
中国肿瘤微创治疗技术指南,"中国研究型医院学会(CRHA,Chinese Research Hospital Association)",站内免费下载,https://guide.medlive.cn/guideline/27266
真皮注射交联透明质酸改善肤质的共识,中国医师协会皮肤科医师分会,站内免费下载,https://guide.medlive.cn/guideline/27234
慢性萎缩性胃炎诊疗和羔羊胃提取物维B12临床应用专家指导意见,中国消化科相关专家小组（统称）,会员可通过APP阅读,https://guide.medlive.cn/guideline/27196
造血干细胞移植后EB病毒相关淋巴增殖性疾病中国专家共识（2022年版）,"中华医学会血液学分会(CMA,CHINESE MEDICAL ASSOCIATION)",会员可通过APP阅读,https://guide.medlive.cn/guideline/27163
多发性骨髓瘤相关静脉血栓栓塞症防治中国专家共识（2022年版）,"中华医学会血液学分会(CMA,CHINESE MEDICAL ASSOCIATION)",有解读会员可通过APP阅读,https://guide.medlive.cn/guideline/27151
综合医院日间手术室运行和管理中国专家共识（2022版）,国家老年疾病临床医学研究中心,站内免费下载,https://guide.medlive.cn/guideline/27060
中小腹壁疝日间手术规范化流程中国专家共识（2022版）,中国日间手术合作联盟,站内免费下载,https://guide.medlive.cn/guideline/26995
中国西南地区成人活动性肺结核诊疗专家共识,中华医学会结核病学分会,站内免费下载,https://guide.medlive.cn/guideline/27324
2022 WHO综合指南：结核病——诊断：结核病感染的检测,"世界卫生组织(WHO,The World Health Organization)",有解读有其他版本站内免费下载,https://guide.medlive.cn/guideline/27308
阴道分娩会阴裂伤的预防与管理临床实践指南,阴道分娩会阴裂伤的预防与管理临床实践指南制定专家组,会员可通过APP阅读,https://guide.medlive.cn/guideline/26954
化疗诱导的周围神经病变诊治中国专家共识（2022版）,中国抗癌协会肿瘤营养与支持治疗专业委员会,会员可通过APP阅读,https://guide.medlive.cn/guideline/26960
复发性流产诊治专家共识（2022）,中华医学会妇产科学分会产科学组,有其他版本会员可通过APP阅读,https://guide.medlive.cn/guideline/26928
乳腺肿瘤整形与乳房重建专家共识 （2022年版）,"中国抗癌协会乳腺癌专业委员会(CACA-CBCS,Chinese Anti-Cancer Association, Committee of Breast Cancer Society)",有其他版本站内免费下载,https://guide.medlive.cn/guideline/27065
男性生育力评估中国专家共识,中国医师协会生殖医学专业委员会,站内免费下载,https://guide.medlive.cn/guideline/27736
心力衰竭生物标志物临床应用中国专家共识,中国医师协会心力衰竭专业委员会,站内VIP下载,https://guide.medlive.cn/guideline/27717
2022 SMFM咨询系列#63：剖宫产瘢痕异位妊娠,"母胎医学会(SMFM,Society for Maternal-Fetal Medicine)",有其他版本第三方数据库下载,https://guide.medlive.cn/guideline/28638
低级别子宫内膜间质肉瘤诊治的专家共识（2022年版）,山东省临床肿瘤学会妇科肿瘤专家委员会,站内免费下载,https://guide.medlive.cn/guideline/26999
中医亚健康状态分类指南,中医相关专家组（统称）,站内免费下载,https://guide.medlive.cn/guideline/27097
少弱精子症中西医结合诊疗河北专家共识（2022版）,河北省中西医结合学会男科专业委员会,站内免费下载,https://guide.medlive.cn/guideline/27182
莱姆病防治专家共识,中国微生物学会人兽共患病病原专业委员会,站内免费下载,https://guide.medlive.cn/guideline/27136
穿刺活检与腹水细胞学检查用于晚期卵巢癌新辅助化疗前诊断的中国专家共识（2022年版）,中国医师协会妇产科医师分会,站内免费下载,https://guide.medlive.cn/guideline/26922
中国霍奇金淋巴瘤的诊断与治疗指南（2022年版）,中国抗癌协会血液肿瘤专业委员会,会员可通过APP阅读,https://guide.medlive.cn/guideline/27134
军事训练伤诊断与防治原则专家共识 （2022 版）,全军训练伤防治相关领域专家组,站内免费下载,https://guide.medlive.cn/guideline/27007
胶原蛋白眶周填充的操作规范专家共识,中国整形外科相关专家小组（统称）,站内免费下载,https://guide.medlive.cn/guideline/27038
塞利尼索在多发性骨髓瘤临床应用的专家共识（2022）,"中华医学会血液学分会(CMA,CHINESE MEDICAL ASSOCIATION)",站内免费下载,https://guide.medlive.cn/guideline/26988
X线和CT引导下经皮穿刺胃造瘘术专家共识 （2022年版）,中国抗癌协会肿瘤消融治疗专业委员会,站内免费下载,https://guide.medlive.cn/guideline/27063
心脏介入诊疗术中并发急性心脏压塞急救与护理专家共识,苏州工业园区心血管健康研究院,站内免费下载,https://guide.medlive.cn/guideline/26998
精神科住院抑郁症患者自杀预防及护理干预措施专家共识,中华护理学会,站内免费下载,https://guide.medlive.cn/guideline/26975
前庭大腺囊肿/脓肿治疗中国专家共识（2022年版）,中国医师协会微无创医学专业委员会,站内免费下载,https://guide.medlive.cn/guideline/26919
2022 SIGN英国国家指南：偏头痛药物治疗（155）-修订版,"苏格兰校际指南网络(SIGN,Scottish Intercollegiate Guidelines Network)",有其他版本站内免费下载,https://guide.medlive.cn/guideline/27046
腓骨肌萎缩症外科治疗专家共识,"中华医学会骨科学分会(COA,Chinese Orthopaedic Association)",站内免费下载,https://guide.medlive.cn/guideline/27011
老年人多病共存名词和定义专家共识（2022）,中华医学会老年医学分会,会员可通过APP阅读,https://guide.medlive.cn/guideline/27033
中国老年人代谢综合征药物治疗专家共识（2022）,中华医学会老年医学分会,会员可通过APP阅读,https://guide.medlive.cn/guideline/27031
高血压患者血压季节性变化临床管理中国专家共识,"中国心脏联盟(CHF,Chinese Heart Federation)",站内免费下载,https://guide.medlive.cn/guideline/26918
晚期肿瘤患者非治疗性恶心呕吐中西医治疗专家共识,"中国抗癌协会(CACA,Chinese Anti-cancer Association)",站内免费下载,https://guide.medlive.cn/guideline/26947
中国脊柱结核外科治疗指南（2022 年版）,中华医学会结核病学分会,站内免费下载,https://guide.medlive.cn/guideline/26848
儿童急性过伸性脊髓损伤诊疗指南（2022版）,"中华医学会骨科学分会(COA,Chinese Orthopaedic Association)",会员可通过APP阅读,https://guide.medlive.cn/guideline/26962
2022 AGO建议：乳腺癌的手术治疗（更新版）,"德国妇科肿瘤小组(AGO,German Gynecological Oncology Group)",站内免费下载,https://guide.medlive.cn/guideline/26946
我国人乳头瘤病毒疫苗免疫策略的专家建议,"中国疾病预防控制中心(CDC,Chinese Center For Disease Control And Prevention)",会员可通过APP阅读,https://guide.medlive.cn/guideline/26945
2022 AIOM/AMD/SIE/SIF共识意见：肿瘤学中皮质类固醇的使用、过度使用、适应证和禁忌证,"意大利肿瘤医学协会(AIOM,Italian Association of Medical Oncology)",站内免费下载,https://guide.medlive.cn/guideline/26910
2022 ISPAD临床实践共识指南：儿童和青少年1型糖尿病的分期,"国际儿童青少年糖尿病协会(ISPAD,International Society for Pediatric and Adolescent Diabetes)",有其他版本站内免费下载,https://guide.medlive.cn/guideline/26909
2022 AGO建议：晚期乳腺癌-聚焦ABC6共识,"德国妇科肿瘤小组(AGO,German Gynecological Oncology Group)",站内免费下载,https://guide.medlive.cn/guideline/26908
2022 ACIP建议：霍乱疫苗,"免疫实践咨询委员会(ACIP,Advisory Committee on Immunization Practices)",第三方数据库下载,https://guide.medlive.cn/guideline/26898
儿童过敏性鼻炎阶梯治疗中国专家共识,中国医师协会变态反应医师分会,会员可通过APP阅读,https://guide.medlive.cn/guideline/26932
2021 AHNS立场声明：PD-1抑制剂在晚期皮肤鳞状细胞癌治疗中的应用,"美国头颈学会(AHNS,American Head and Neck Society)",站内免费下载,https://guide.medlive.cn/guideline/26925
卵巢畸胎瘤相关抗N-甲基-D-天冬氨酸受体脑炎的临床诊治中国专家共识（2022年版）,中国医师协会妇产科医师分会,站内免费下载,https://guide.medlive.cn/guideline/26923
2022 WHO建议：产前应用皮质类固醇改善早产结局,"世界卫生组织(WHO,The World Health Organization)",有其他版本站内免费下载,https://guide.medlive.cn/guideline/27307
2022 WHO建议：改善早产结局的抗宫缩治疗,"世界卫生组织(WHO,The World Health Organization)",有其他版本站内免费下载,https://guide.medlive.cn/guideline/27294
2022 BAN实践指南：卒中康复—第Ⅱ部分,"巴西神经病学学会(BAN,Brazilian Academy of Neurology)",有其他版本站内免费下载,https://guide.medlive.cn/guideline/27047
2022 SCCT专家共识：急诊科急性胸痛患者冠脉CT血管造影的应用,"美国心血管计算机断层扫描学会(SCCT,Society of Cardiovascular Computed Tomography)",第三方数据库下载,https://guide.medlive.cn/guideline/27028
中国乳腺癌抗体药物偶联物安全性管理专家共识,中国医师协会肿瘤医师分会,会员可通过APP阅读,https://guide.medlive.cn/guideline/26958
2022 AARC临床实践指南：新生儿和儿科患者毛细血管血气取样,"美国呼吸治疗学会(AARC,American Association for Respiratory Care)",站内免费下载,https://guide.medlive.cn/guideline/27094
