标题,来源,下载方式,链接
子宫内膜癌诊疗指南（2022 年版）,中华人民共和国国家卫生健康委员会,站内免费下载,https://guide.medlive.cn/guideline/25574
乳腺癌诊疗指南（2022年版）,中华人民共和国国家卫生健康委员会,有其他版本站内免费下载,https://guide.medlive.cn/guideline/25564
胃癌诊疗指南（2022年版）,中华人民共和国国家卫生健康委员会,有其他版本站内免费下载,https://guide.medlive.cn/guideline/25562
原发性肺癌诊疗指南（2022 年版）,国家癌症中心,有其他版本站内免费下载,https://guide.medlive.cn/guideline/25547
宫颈癌诊疗指南（2022年版）,中华人民共和国国家卫生健康委员会,站内免费下载,https://guide.medlive.cn/guideline/25586
肾细胞癌诊疗指南（2022年版）,中华人民共和国国家卫生健康委员会,站内免费下载,https://guide.medlive.cn/guideline/25566
卵巢癌诊疗指南（2022 年版）,中华人民共和国国家卫生健康委员会,有其他版本站内免费下载,https://guide.medlive.cn/guideline/25587
前列腺癌诊疗指南 （2022年版）,中华人民共和国国家卫生健康委员会,有其他版本站内免费下载,https://guide.medlive.cn/guideline/25585
甲状腺癌诊疗指南 （2022年版）,中华人民共和国国家卫生健康委员会,有其他版本站内免费下载,https://guide.medlive.cn/guideline/25584
脑胶质瘤诊疗指南 （2022年版）,中华人民共和国国家卫生健康委员会,有其他版本站内免费下载,https://guide.medlive.cn/guideline/25583
淋巴瘤诊疗指南 （2022年版）,中华人民共和国国家卫生健康委员会,站内免费下载,https://guide.medlive.cn/guideline/25582
黑色素瘤诊疗指南（2022 年版）,中华人民共和国国家卫生健康委员会,有其他版本站内免费下载,https://guide.medlive.cn/guideline/25581
骨髓增生异常综合征伴原始细胞增多 （MDS-EB）诊疗指南 （2022年版）,中华人民共和国国家卫生健康委员会,站内免费下载,https://guide.medlive.cn/guideline/25535
弥漫性大B 细胞淋巴瘤诊疗指南 （2022 年版）,中华人民共和国国家卫生健康委员会,站内免费下载,https://guide.medlive.cn/guideline/25568
血友病A诊疗指南 （2022年版）,中华人民共和国国家卫生健康委员会,站内免费下载,https://guide.medlive.cn/guideline/25567
自身免疫性溶血性贫血诊疗指南（2022 年版）,中华人民共和国国家卫生健康委员会,站内免费下载,https://guide.medlive.cn/guideline/25549
膀胱癌诊疗指南（2022年版）,国家癌症中心,站内免费下载,https://guide.medlive.cn/guideline/25548
慢性淋巴细胞白血病/小淋巴细胞淋巴瘤诊疗指南（2022年版）,中华人民共和国国家卫生健康委员会,站内免费下载,https://guide.medlive.cn/guideline/25550
食管癌诊疗指南 （2022年版）,中华人民共和国国家卫生健康委员会,有其他版本站内免费下载,https://guide.medlive.cn/guideline/25561
胰腺癌诊疗指南（2022年版）,中华人民共和国国家卫生健康委员会,有其他版本站内免费下载,https://guide.medlive.cn/guideline/25563
慢性髓性白血病诊疗指南（2022年版）,中华人民共和国国家卫生健康委员会,站内免费下载,https://guide.medlive.cn/guideline/25565
2022 BTS临床声明：运动员呼吸系统问题的评估和管理,"英国胸科协会(BTS,British Thoracic Society)",站内免费下载,https://guide.medlive.cn/guideline/25545
2022 AHA科学声明：儿童和青年人群SARS-CoV-2感染及相关心血管表现和并发症,"美国心脏协会(AHA,American Heart Association)",第三方数据库下载,https://guide.medlive.cn/guideline/25525
2022 BHRS专家共识：无导线起搏系统的最佳使用和临床应用,"英国心律学会(BHRS,British Heart Rhythm Society)",站内免费下载,https://guide.medlive.cn/guideline/27130
成人斯蒂尔病诊疗规范,中华医学会风湿病学分会,会员可通过APP阅读,https://guide.medlive.cn/guideline/30692
儿童结核性脑膜炎诊断专家共识,中华医学会结核病学分会,会员可通过APP阅读,https://guide.medlive.cn/guideline/25555
儿童肺结核诊断专家共识,中华医学会结核病学分会,会员可通过APP阅读,https://guide.medlive.cn/guideline/25554
高血压院外互联网管理中国专家共识,中国心血管健康联盟高血压达标中心,站内VIP下载,https://guide.medlive.cn/guideline/25628
新型冠状病毒奥密克戎变异株感染中医药防治专家共识,世界中医药学会联合会,站内免费下载,https://guide.medlive.cn/guideline/25590
卵巢储备功能减退临床诊治专家共识,卵巢储备功能减退临床诊治专家共识专家组,站内免费下载,https://guide.medlive.cn/guideline/25577
儿童侵袭性肺部真菌感染临床实践专家共识（2022版）,中华医学会儿科学分会,有其他版本会员可通过APP阅读,https://guide.medlive.cn/guideline/25539
2022 KASL临床实践指南：慢性乙型肝炎的管理,"韩国肝脏病研究学会(KASL,Korean Association for the Study of the Liver)",有其他版本站内免费下载,https://guide.medlive.cn/guideline/25599
2022 CCO临床实践指南：多基因图谱分析在早期浸润性乳腺癌中的临床应用,"加拿大安大略癌症治疗中心(CCO,Cancer Care Ontario)",站内免费下载,https://guide.medlive.cn/guideline/25640
血液系统肿瘤患者的营养治疗专家共识,中国抗癌协会肿瘤营养与支持治疗专业委员会,站内免费下载,https://guide.medlive.cn/guideline/25603
2021 VA/DoD临床实践指南：慢性多症状疾病的管理（概要）,"退伍军人卫生署和美国国防部(VA/DoD,Veterans Health Administration and the US Department of Defense)",第三方数据库下载,https://guide.medlive.cn/guideline/25537
中成药治疗骨质疏松症临床应用指南（2021 年）,《中成药治疗优势病种临床应用指南》标准化项目组,站内免费下载,https://guide.medlive.cn/guideline/26086
2022 CCMG实践指南：卵巢癌BRCA1／2肿瘤检测,"加拿大医学遗传学家学会(CCMG,Canadian College of Medical Geneticists)",站内免费下载,https://guide.medlive.cn/guideline/25518
2022 EANM指南：放射性药物的质量风险管理,"欧洲核医学协会(EANM,European Association of Nuclear Medicine)",站内免费下载,https://guide.medlive.cn/guideline/25510
2022 法国最佳实践指南：自身免疫性肝炎的诊断和管理,国外肝病科相关专家小组（统称）,站内免费下载,https://guide.medlive.cn/guideline/28440
2022 SIGN立场声明：长效丁丙诺啡注射剂用于阿片类药物替代治疗（165）,"苏格兰校际指南网络(SIGN,Scottish Intercollegiate Guidelines Network)",站内免费下载,https://guide.medlive.cn/guideline/25778
2022 中国专家共识：磁力再通治疗儿童食管狭窄,第三届国际磁外科会议科学委员会,站内免费下载,https://guide.medlive.cn/guideline/26116
2022 专家意见：多囊卵巢综合征患者妊娠的临床管理,国外妇产科相关专家组（统称）,站内免费下载,https://guide.medlive.cn/guideline/25499
2022 OEGGG建议：妊娠期缺铁性贫血的诊断和治疗,"奥地利妇产科学会(OEGGG,Austrian Society for Gynecology and Obstetrics)",站内免费下载,https://guide.medlive.cn/guideline/25495
2021 JCS/JSCVS/JATS/JSVS指南：植入式左心室辅助装置治疗晚期心力衰竭,"日本循环学会(JCS,Japanese Circulation Society)",站内免费下载,https://guide.medlive.cn/guideline/25509
2022 ISOPP立场声明：肿瘤药师在恶性肿瘤免疫检查点抑制剂治疗中的作用,"国际肿瘤药师协会(ISOPP,International society of oncology pharmacy practitioners)",站内免费下载,https://guide.medlive.cn/guideline/25503
2021 AAOS临床实践指南：膝关节骨关节炎的管理（非关节成形术）-第3版,"美国骨科医师学会(AAOS,American Academy of Orthopaedic Surgeons)",有其他版本第三方数据库下载,https://guide.medlive.cn/guideline/25501
2022 NOGG临床指南：骨质疏松的预防和治疗,"国家骨质疏松指南组（英国）(NOGG,National Osteoporosis Guideline Group)",有其他版本站内免费下载,https://guide.medlive.cn/guideline/25490
2022 共识声明：COVID-19相关肺毛霉菌病的定义，诊断和管理,国外呼吸科专家组（统称）,第三方数据库下载,https://guide.medlive.cn/guideline/25522
2022 EHRA/HRS/APHRS/LAHRS专家共识声明：心脏病基因检测的现状,"欧洲心律学会(EHRA,European Heart Rhythm Association)",有解读站内免费下载,https://guide.medlive.cn/guideline/25492
2022 EANM循证指南：血管移植物感染的影像学检查,"欧洲核医学协会(EANM,European Association of Nuclear Medicine)",站内免费下载,https://guide.medlive.cn/guideline/25489
2022 SFE/SFEDP共识声明：库欣综合征的诊断,"法国内分泌学会(SFE,French Society of Endocrinology)",站内免费下载,https://guide.medlive.cn/guideline/28412
瓷美学修复中预备体边缘与修复体边缘的专家共识,中国口腔科相关专家组（统称）,站内免费下载,https://guide.medlive.cn/guideline/25486
2022 中欧和东欧专家共识：维生素D缺乏的预防、诊断和治疗,国外营养相关专家小组（统称）,站内免费下载,https://guide.medlive.cn/guideline/25541
2022 国际共识建议：B型血友病患者的管理,国外血液科相关专家小组,有解读站内免费下载,https://guide.medlive.cn/guideline/25519
2022 ECIL/EBMT/EORTC/ELN临床实践指南：急性白血病靶向药物和生物治疗的感染并发症,"欧洲白血病感染会议(ECIL,European Conference on Infections in Leukaemia)",站内免费下载,https://guide.medlive.cn/guideline/25485
变应性鼻炎经典名方临床应用专家共识,北京中医药学会耳鼻咽喉专业委员会,站内免费下载,https://guide.medlive.cn/guideline/25511
2022 ACOG临床实践指南：绝经后骨质疏松症的管理（No.2）,"美国妇产科医师学会(ACOG,American College of Obstetricians and Gynecologists)",有其他版本站内免费下载,https://guide.medlive.cn/guideline/25958
2022 临床实践指南：难治性抑郁症的治疗,国外精神科相关专家小组（统称）,站内免费下载,https://guide.medlive.cn/guideline/25698
2022 KSLM指南：COVID-19分子诊断检测的移动实验室,"韩国检验医学学会(KSLM,Korean Society for Laboratory Medicine)",站内免费下载,https://guide.medlive.cn/guideline/25671
青霉素皮肤试验临床操作专家共识,北京护理学会,站内免费下载,https://guide.medlive.cn/guideline/25468
2022 MASCC专家意见：临床辅助营养在晚期癌症患者中的应用,"癌症支持疗法多国学会(MASCC,Multinational Association of Supportive Care in Cancer)",站内免费下载,https://guide.medlive.cn/guideline/25514
2022 巴西指南：囊性纤维化的营养治疗,国外遗传代谢性疾病专家组（统称）,站内免费下载,https://guide.medlive.cn/guideline/25507
2021 ELN建议：合理应用细胞减少药物治疗真性红细胞增多症,"欧洲白血病网(ELN,European LeukmiaNet)",站内免费下载,https://guide.medlive.cn/guideline/25482
2022 NCRI共识意见：儿童和成人结节性淋巴细胞为主的霍奇金淋巴瘤的所有阶段的管理,"英国国家癌症研究所(NCRI,National Cancer Research Institute)",站内免费下载,https://guide.medlive.cn/guideline/25481
2022 ERN GENTURIS临床实践指南：神经鞘瘤的诊断、治疗、管理以及监测,"欧洲罕见遗传肿瘤风险综合征网(ERN GENTURIS,European Reference Network-GENTURIS)",站内免费下载,https://guide.medlive.cn/guideline/25478
2022 AHA/ACC/HFSA 指南：心力衰竭的管理,"美国心脏协会(AHA,American Heart Association)",有解读有其他版本第三方数据库下载,https://guide.medlive.cn/guideline/25475
2022 AHA/ACC/HFSA 指南：心力衰竭的管理（概要）,"美国心脏协会(AHA,American Heart Association)",有其他版本站内免费下载,https://guide.medlive.cn/guideline/25474
2022 ACIP建议：普及19-59岁成人乙肝疫苗接种（更新）,"免疫实践咨询委员会(ACIP,Advisory Committee on Immunization Practices)",第三方数据库下载,https://guide.medlive.cn/guideline/25471
2022 ACG指南：Barrett's食管的诊断和管理（更新版）,"美国胃肠病学会(ACG,American College of Gastroenterology)",有其他版本第三方数据库下载,https://guide.medlive.cn/guideline/25465
2022 SFP共识：自体皮下注射长效醋酸甲羟孕酮(DMPA-SC),"美国计划生育学会(SFP,Society of Family Planning)",第三方数据库下载,https://guide.medlive.cn/guideline/26306
中国肿瘤整合诊治指南（CACA）——乳腺癌（V1.0 2022）,"中国抗癌协会乳腺癌专业委员会(CACA-CBCS,Chinese Anti-Cancer Association, Committee of Breast Cancer Society)",第三方数据库下载,https://guide.medlive.cn/guideline/28492
2022 IDSA指南：抗菌药物耐药性革兰氏阴性菌感染的治疗（V2.0）,"美国感染病学会(IDSA,Infectious Diseases Society of America)",有其他版本第三方数据库下载,https://guide.medlive.cn/guideline/26050
2022 SIS指南：胆囊疾病行胆囊切除术患者的抗生素应用,"外科感染学会(SIS,Surgical Infection Society)",站内免费下载,https://guide.medlive.cn/guideline/25476
2022更新—2015 NICE指南：儿童和青年人糖尿病（1型和2型）的诊断和管理（NG.18）,"英国国家卫生与临床优化研究所 (NICE,National Institute for Health and Clinical Excellence)",有其他版本站内免费下载,https://guide.medlive.cn/guideline/25469
2022更新—2015 NICE指南：成人1型糖尿病的诊断和管理（NG.17）,"英国国家卫生与临床优化研究所 (NICE,National Institute for Health and Clinical Excellence)",有其他版本第三方数据库下载,https://guide.medlive.cn/guideline/25467
2022 BSR指南：儿童、青少年和成人特发性炎性肌病患者的管理,"英国风湿病学会(BSR,British Society for Rheumatology)",第三方数据库下载,https://guide.medlive.cn/guideline/25464
2022更新—2015 NICE指南：成人2型糖尿病的管理（NG.28）,"英国国家卫生与临床优化研究所 (NICE,National Institute for Health and Clinical Excellence)",有其他版本第三方数据库下载,https://guide.medlive.cn/guideline/25459
中成药治疗类风湿关节炎临床应用指南（2022年）,《中成药治疗优势病种临床应用指南》标准化项目组,站内免费下载,https://guide.medlive.cn/guideline/28432
高危新生儿行为神经发育早期干预专家共识,中国优生优育协会婴幼儿发育专业委员会,站内免费下载,https://guide.medlive.cn/guideline/25575
慢性阻塞性肺疾病临床诊治实施规范,慢性阻塞性肺疾病临床诊治实施规范专家组,会员可通过APP阅读,https://guide.medlive.cn/guideline/25738
自动乳腺容积超声技术专家共识（2022版）,中国超声医学工程学会,有其他版本站内免费下载,https://guide.medlive.cn/guideline/25527
阴茎硬结症诊断与治疗指南,中华医学会男科学分会,站内免费下载,https://guide.medlive.cn/guideline/25768
下丘脑促性腺激素释放激素脉冲泵在男科疾病中应用专家共识,中华医学会男科学分会,站内免费下载,https://guide.medlive.cn/guideline/25766
心血管慢病药品临床综合评价杭州专家共识,杭州市药事管理质控中心药品评价专家组,站内免费下载,https://guide.medlive.cn/guideline/25794
经脐单孔腹腔镜手术脐部切口管理专家共识（2022年版）,中国医师协会微无创医学单孔与阴道腔镜学组,站内免费下载,https://guide.medlive.cn/guideline/25483
妊娠合并急性胰腺炎诊治专家共识（2022）,"中国优生科学协会(CHBSA,China Healthy Birth Science Association)",站内免费下载,https://guide.medlive.cn/guideline/25451
儿童反复呼吸道感染临床诊疗路径（2022 版）,中国医师协会儿科医师分会,有其他版本站内免费下载,https://guide.medlive.cn/guideline/25805
中国神经免疫病免疫吸附治疗临床应用指南,中国免疫学会神经免疫学分会,站内免费下载,https://guide.medlive.cn/guideline/25679
高血压急症的问题中国专家共识,中国医师协会高血压专业委员会,站内免费下载,https://guide.medlive.cn/guideline/25508
肝细胞癌新辅助及转化治疗中国专家共识,中国医疗保健国际交流促进会,有其他版本站内免费下载,https://guide.medlive.cn/guideline/25700
感染性心内膜炎外科治疗中国专家共识,"中华医学会胸心血管外科学分会(CSTCS,Chinese Society for Thoracic and Cardiovascular Surgery)",会员可通过APP阅读,https://guide.medlive.cn/guideline/25530
早期乳腺癌女性患者的骨健康管理中国专家共识（2022年版）,"中国抗癌协会乳腺癌专业委员会(CACA-CBCS,Chinese Anti-Cancer Association, Committee of Breast Cancer Society)",站内免费下载,https://guide.medlive.cn/guideline/25505
肾癌基因检测中国专家共识（2021版）,中国医疗保健国际交流促进会,站内免费下载,https://guide.medlive.cn/guideline/25553
福建省中医药防治新型冠状病毒肺炎专家共识（试行第五版）,福建省中医药学会感染病分会,有其他版本站内免费下载,https://guide.medlive.cn/guideline/25621
2022 循证共识指南：药物与抗癌药物的相互作用,国外肿瘤科相关专家小组（统称）,站内免费下载,https://guide.medlive.cn/guideline/25526
非创伤性软组织疼痛急诊管理专家共识（2022）,中国医促会急诊医学分会,有其他版本站内免费下载,https://guide.medlive.cn/guideline/25500
成人颈椎损伤急诊诊治专家共识,"中国医师协会急诊医师分会(CHINESE COLLEGE OF EMERGENCY PHYSICANS,CCEP)",有其他版本站内免费下载,https://guide.medlive.cn/guideline/25494
2022 JSPM临床指南：癌痛的药物治疗建议,"日本姑息医学会(JSPM,Japanese Society of Palliative Medicine)",有其他版本站内免费下载,https://guide.medlive.cn/guideline/25477
2022 WHO建议：促进积极产后体验的产妇和新生儿护理,"世界卫生组织(WHO,The World Health Organization)",站内免费下载,https://guide.medlive.cn/guideline/25456
2022 SIC/SICP意见书：成人和儿童罕见心肌病的诊断和管理,"意大利心脏病学会(SIC,Italian Society of Cardiology)",站内免费下载,https://guide.medlive.cn/guideline/25493
2022 ELSO指南：液体超载、急性肾损伤以及电解质管理,"体外生命支持组织(ELSO,Extracorporeal Life Support Organization)",有解读第三方数据库下载,https://guide.medlive.cn/guideline/25441
心脏瓣膜外科抗凝治疗中国专家共识,"中华医学会胸心血管外科学分会(CSTCS,Chinese Society for Thoracic and Cardiovascular Surgery)",会员可通过APP阅读,https://guide.medlive.cn/guideline/25542
人胃肠上皮组织类器官的构建与保藏操作指南,中国医药生物技术协会,站内免费下载,https://guide.medlive.cn/guideline/26976
睾丸扭转诊断与治疗指南,中华医学会男科学分会,站内免费下载,https://guide.medlive.cn/guideline/25770
雾化吸入在支气管镜检查中的应用云南专家共识（第1版）,云南省传染性疾病临床医学中心,站内免费下载,https://guide.medlive.cn/guideline/25602
儿童胸部实体肿瘤外科诊疗流程的专家共识,中华医学会小儿外科学分会,站内免费下载,https://guide.medlive.cn/guideline/25588
中国听神经病临床实践指南（2022版）,中国听神经病临床诊断与干预多中心研究协作组,会员可通过APP阅读,https://guide.medlive.cn/guideline/25498
中成药治疗成人支气管哮喘临床应用指南（2021年）,《中成药治疗优势病种临床应用指南》标准化项目组,站内免费下载,https://guide.medlive.cn/guideline/25520
2020 临床实践指南：过敏反应的急诊管理,中国药理学会(Chinese Pharmacological Society),有其他版本第三方数据库下载,https://guide.medlive.cn/guideline/25572
2022 WHO促进积极妊娠体验产前保健建议：母胎评估更新—妊娠24周前超声检查,"世界卫生组织(WHO,The World Health Organization)",有其他版本站内免费下载,https://guide.medlive.cn/guideline/25460
2022 循证共识建议：高复发风险的原发性黑色素瘤患者的随访,国外肿瘤科相关专家小组（统称）,站内免费下载,https://guide.medlive.cn/guideline/25449
2022 JASTRO共识指南：妇科肿瘤腔内和间质联合近距离放射治疗,"日本放射肿瘤学协会(JASTRO,Japanese Society for Radiation Oncology)",站内免费下载,https://guide.medlive.cn/guideline/25440
2022 韩国专家建议：免疫性血小板减少症的管理,"韩国血液学会(KSH,Korean Society of Hematology)",有其他版本站内免费下载,https://guide.medlive.cn/guideline/25434
2022 AHA/ASA科学声明：发病前残疾和痴呆患者急性缺血性脑卒中的血管内治疗和溶栓治疗,"美国心脏协会(AHA,American Heart Association)",第三方数据库下载,https://guide.medlive.cn/guideline/25431
2022 SSR指南：成人CT和MRI检查偶发的孤立性骨病变的诊断管理,"骨骼放射学会(SSR,Society of Skeletal Radiolody)",站内免费下载,https://guide.medlive.cn/guideline/25429
2022 KSPE临床实践指南：优化儿童和青少年骨健康,"韩国儿童内分泌学会(KSPE,Korean Society of Pediatric Endocrinology)",站内免费下载,https://guide.medlive.cn/guideline/25487
冠心病患者心脏康复健康教育处方护理专家共识,北京护理学会,会员可通过APP阅读,https://guide.medlive.cn/guideline/25688
中国线粒体脑肌病伴高乳酸血症和卒中样发作的诊治专家共识,北京医学会罕见病分会,会员可通过APP阅读,https://guide.medlive.cn/guideline/25800
变应性鼻炎的分类和诊断专家共识（2022，成都）,中国鼻病研究协作组,站内免费下载,https://guide.medlive.cn/guideline/26071
2022 JARN意见书：针对疾病的营养物理疗法,"日本康复营养协会(JARN,Japanese Association of Rehabilitation Nutrition)",第三方数据库下载,https://guide.medlive.cn/guideline/26040
极长链酰基辅酶A脱氢酶缺乏症筛诊治专家共识,中华医学会医学遗传学分会,站内免费下载,https://guide.medlive.cn/guideline/25660
不稳定型心绞痛中医诊疗专家共识,中医临床诊疗指南制修订项目不稳定型心绞痛项目组,站内免费下载,https://guide.medlive.cn/guideline/25427
2022 ACR／EULAR 嗜酸性肉芽肿性多血管炎的分类标准,"美国风湿病学会(ACR,American College of Rheumatology)",站内免费下载,https://guide.medlive.cn/guideline/25579
化疗所致恶心呕吐的药物防治指南,中国药学会医院药学专业委员会,站内免费下载,https://guide.medlive.cn/guideline/25446
动脉粥样硬化中西医防治专家共识（2021年）,"中国医师协会中西医结合医师分会(DSIM/CMDA,Doctor Society of integrative Medicine，Chinese Medical Doctor Association)",有其他版本站内免费下载,https://guide.medlive.cn/guideline/25443
CT电磁导航系统引导下经皮穿刺诊断周围型肺癌的操作规范专家共识（2021版）,上海市抗癌协会,站内免费下载,https://guide.medlive.cn/guideline/25433
2022 昆士兰临床指南：小于胎龄新生儿（V5）,"昆士兰卫生组织(QLD,Queensland Health)",有解读有其他版本站内免费下载,https://guide.medlive.cn/guideline/25458
中成药防治新型冠状病毒肺炎专家共识,中国中药协会呼吸病药物研究专业委员会,站内免费下载,https://guide.medlive.cn/guideline/25444
2022 EAU指南：肾细胞癌（更新版）,"欧洲泌尿外科学会(EAU,European Association of Urology)",有其他版本站内免费下载,https://guide.medlive.cn/guideline/25442
2022 亚洲指南：尖锐湿疣,"日本化疗学会(JSC,Japanese Society of Chemotherapy)",站内免费下载,https://guide.medlive.cn/guideline/25430
2022 德国指南：脊髓损伤/疾病神经源性肠功能障碍的管理,国外神经外科相关专家小组（统称）,第三方数据库下载,https://guide.medlive.cn/guideline/25422
脊髓性肌萎缩症呼吸管理专家共识（2022版）,中国医师协会儿科医师分会,会员可通过APP阅读,https://guide.medlive.cn/guideline/25423
心源性卒中治疗中国专家共识（2022）,中华医学会老年医学分会,会员可通过APP阅读,https://guide.medlive.cn/guideline/25417
2022 专家共识：替妥木单抗治疗甲状腺眼病,国外眼科专家协作组（统称）,站内免费下载,https://guide.medlive.cn/guideline/25597
肾移植受者人类微小病毒B19感染临床诊疗技术规范（2022版）,中华医学会器官移植学分会,站内免费下载,https://guide.medlive.cn/guideline/25401
ST段抬高型心肌梗死患者急诊PCI微循环保护策略中国专家共识,中华医学会心血管病学分会(Chinese Society of Cardiology),会员可通过APP阅读,https://guide.medlive.cn/guideline/25410
2020 JOA临床实践指南：软组织肿瘤的管理,"日本骨科学会(JOA,Japanese Orthopaedic Association)",站内免费下载,https://guide.medlive.cn/guideline/25425
2022 EAN指南：罕见神经系统疾病,"欧洲神经病学学会(EAN,European Academy of Neurology)",站内免费下载,https://guide.medlive.cn/guideline/25404
Ellansé 的材料特性及鼻唇沟填充的专家共识,Ellansé专家共识工作组,站内免费下载,https://guide.medlive.cn/guideline/26068
老年睡眠呼吸暂停综合征诊断评估专家共识,中国老年医学学会,站内免费下载,https://guide.medlive.cn/guideline/25398
