标题,来源,下载方式,链接
先天性巨细胞病毒感染筛查与临床干预指南,中华医学会围产医学分会,站内免费下载,https://guide.medlive.cn/guideline/17933
中国骨肌疾病体外冲击波疗法指南（2019年版）,"中国研究型医院学会(CRHA,Chinese Research Hospital Association)",有其他版本站内免费下载,https://guide.medlive.cn/guideline/17916
2019 ISPN共识指南：发展中国家溶血性尿毒综合征,"印度儿童肾脏病学会(ISPN,Indian Society of Pediatric Nephrology)",站内免费下载,https://guide.medlive.cn/guideline/17889
2019 接受肾脏保守治疗患者的护理建议：慢性肾病及症状的管理,肾脏病相关专家小组（统称）,第三方数据库下载,https://guide.medlive.cn/guideline/17938
2019 BC指南：基层医疗中前列腺癌的诊断，推荐以及随访（草稿）,"不列颠哥伦比亚省临床实践指南中心(BC,Clinical Practice Guidelines and Protocols in British Columbia)",有其他版本站内免费下载,https://guide.medlive.cn/guideline/17914
2019 ESO指南：卒中或短暂性脑缺血发作以及非瓣膜性房颤患者卒中和其他血栓栓塞事件二级预防抗栓治疗,"欧洲卒中组织(ESO,European Stroke Organisation)",站内免费下载,https://guide.medlive.cn/guideline/17893
尿素循环障碍的诊断和管理指南（第1版）,国外遗传代谢性疾病专家组（统称）,站内免费下载,https://guide.medlive.cn/guideline/17883
2019 GINA指南：成人和青少年难治性严重哮喘的诊断和管理（袖珍版）,"全球哮喘防治创议(GINA,Global INitiative for Asthma)",站内免费下载,https://guide.medlive.cn/guideline/17873
2019 GINA 全球哮喘处理和预防策略（针对成人和5岁以上儿童）-袖珍指南,"全球哮喘防治创议(GINA,Global INitiative for Asthma)",有其他版本站内免费下载,https://guide.medlive.cn/guideline/17866
2019 EAPM欧洲共识指南：呼吸窘迫综合征的管理,"欧洲围产医学协会(EAPM,European Association of Perinatal Medicine)",有解读有其他版本第三方数据库下载,https://guide.medlive.cn/guideline/17861
中国专家建议：经支气管镜介入治疗恶性中心气道狭窄-英文版,北京健康促进会呼吸及肿瘤介入诊疗联盟,有其他版本站内免费下载,https://guide.medlive.cn/guideline/17855
2019 NICE指南：手术部位感染的预防和治疗（NG.125）,"英国国家卫生与临床优化研究所 (NICE,National Institute for Health and Clinical Excellence)",站内免费下载,https://guide.medlive.cn/guideline/17854
骨科手术机器人辅助胸腰椎椎弓根螺钉置入指南—英文版,中国生物医学工程学会(chinese society of biomedical engineering),站内免费下载,https://guide.medlive.cn/guideline/17974
2019 BSG/RCoA联合立场声明：复杂胃肠镜检查过程中深度镇静和麻醉,"英国胃肠病学会(BSG,British Society of Gastroenterology)",站内免费下载,https://guide.medlive.cn/guideline/18299
2019 立场声明：肛门生殖器疣的诊断和管理,国外皮肤性病相关专家小组（统称）,站内免费下载,https://guide.medlive.cn/guideline/17851
2019 香港共识声明：成人慢性特发性便秘的诊断和管理,香港医学相关专家组（统称）,站内免费下载,https://guide.medlive.cn/guideline/17871
2019 RANZCP指南：电休克治疗管理,"澳大利亚与新西兰皇家精神科医师学会(RANZCP,Royal Australian and New Zealand college of Psychiatrists)",站内免费下载,https://guide.medlive.cn/guideline/17852
原发性骨质疏松症社区规范化管理方案,中国医师协会全科医师分会,站内免费下载,https://guide.medlive.cn/guideline/17839
2019 WGO全球指南：内镜消毒（更新）-按资源水平分级处理的方法,"世界胃肠病学组织(WGO,World Gastroenterology Organisation)",有翻译有其他版本站内免费下载,https://guide.medlive.cn/guideline/18326
2019 ACP指南：乳腺癌一般风险女性筛查,"美国医师协会(ACP,American College of Physicians)",站内免费下载,https://guide.medlive.cn/guideline/17838
2019 ASGE指南：胆总管结石的内镜管理,"美国胃肠内镜学会(ASGE,American Society for Gastrointestinal Endoscopy)",有翻译站内免费下载,https://guide.medlive.cn/guideline/17864
2019 AAGBI/BADS指南：日间手术,"大不列颠爱尔兰麻醉学会(AAGBI,Association of Anaesthetists of Great Britain and Ireland)",有解读有其他版本站内免费下载,https://guide.medlive.cn/guideline/17845
2019 AHA科学声明：癌症患者和生存者心脏-肿瘤康复管理心血管结局,"美国心脏协会(AHA,American Heart Association)",第三方数据库下载,https://guide.medlive.cn/guideline/17868
2018 JSH实践指南：血液恶性肿瘤—骨髓瘤：多发性骨髓瘤相关疾病,"日本血液学会(JSH,Japanese Society of Hematology)",站内免费下载,https://guide.medlive.cn/guideline/17848
2018 KSNO指南：胶质母细胞瘤（V.2018.01）,"韩国神经肿瘤学学会(KSNO,Korean Society for Neuro-Oncology)",站内免费下载,https://guide.medlive.cn/guideline/18016
澳大利亚哮喘手册 2.0版,"澳大利亚国家哮喘委员会(NAC,National Asthma Council (Australia))",站内免费下载,https://guide.medlive.cn/guideline/17818
2018 JSH实践指南：血液恶性肿瘤—骨髓瘤：多发性骨髓瘤,"日本血液学会(JSH,Japanese Society of Hematology)",站内免费下载,https://guide.medlive.cn/guideline/17824
2019 ESGE指南：胆总管结石的内镜管理,"欧洲胃肠道内窥镜学会(ESGE,European Society of Gastrointestinal Endoscopy)",有翻译第三方数据库下载,https://guide.medlive.cn/guideline/17821
2019 NICE指南：早产儿专业新生儿呼吸护理（NG.124）,"英国国家卫生与临床优化研究所 (NICE,National Institute for Health and Clinical Excellence)",站内免费下载,https://guide.medlive.cn/guideline/17826
2019 ISHLT共识报告：慢性肺同种异体移植功能障碍的定义，诊断标准和治疗方法,"国际心肺移植协会(ISHLT,The International Society of Heart and lung Transplantantion)",站内免费下载,https://guide.medlive.cn/guideline/17849
心脏重症相关高血压管理专家共识,中国心脏重症专家委员会,站内VIP下载,https://guide.medlive.cn/guideline/18104
围手术期血压管理医-药专家共识,广东省药学会,站内免费下载,https://guide.medlive.cn/guideline/17799
学校结核病疫情流行病学调查和现场处置专家共识,上海市防痨协会,站内免费下载,https://guide.medlive.cn/guideline/17888
2019 JSPM临床指南：癌症患者胃肠道症状的管理建议,"日本姑息医学会(JSPM,Japanese Society of Palliative Medicine)",站内免费下载,https://guide.medlive.cn/guideline/17812
2019 NICE指南：女性尿失禁和盆腔器官脱垂的管理（NG.123）,"英国国家卫生与临床优化研究所 (NICE,National Institute for Health and Clinical Excellence)",站内免费下载,https://guide.medlive.cn/guideline/17814
2019 加拿大专家共识：成人静脉注射铁剂超敏反应的管理,国外血液科相关专家小组,站内免费下载,https://guide.medlive.cn/guideline/17815
中国肝移植免疫抑制治疗与排斥反应诊疗规范（2019版）,中华医学会器官移植学分会,站内免费下载,https://guide.medlive.cn/guideline/22461
2019 CAG临床实践指南：肠易激综合征（IBS）的管理,"加拿大胃肠病学协会(CAG,The Canadian Association of Gastroenterology)",站内免费下载,https://guide.medlive.cn/guideline/18478
2019 CASP专家共识：颈源性头痛（英文版）,"中国疼痛研究会(CASP,Chinese Association for the Study of Pain)",站内免费下载,https://guide.medlive.cn/guideline/18155
2019 WHO综合指南：耐药结核的治疗,"世界卫生组织(WHO,The World Health Organization)",有其他版本站内免费下载,https://guide.medlive.cn/guideline/17832
老年急性髓系白血病（非急性早幼粒细胞白血病）中西医结合诊疗专家共识,"中国中西医结合学会(CAIM,Chinese Association of Integrative Medicine)",站内免费下载,https://guide.medlive.cn/guideline/17822
2019 WHO指南：结核感染的预防和控制（更新版）,"世界卫生组织(WHO,The World Health Organization)",站内免费下载,https://guide.medlive.cn/guideline/17798
2019 昆士兰临床指南：原发性产后出血,"昆士兰卫生组织(QLD,Queensland Health)",有其他版本站内免费下载,https://guide.medlive.cn/guideline/17793
2019 临床建议：接受生物仿制药治疗的IBD患者反安慰剂效应的预防和管理,国外消化科相关专家小组（统称）,站内免费下载,https://guide.medlive.cn/guideline/17803
2019 ESC意见书：经导管成人先天性心脏病干预,"欧洲心脏病学会(ESC,European Society of Cardiology)",站内免费下载,https://guide.medlive.cn/guideline/17801
2019 EDF/EADV指南：慢性瘙痒,"欧洲皮肤病学论坛(EDF,European Dermatology Forum)",有其他版本站内免费下载,https://guide.medlive.cn/guideline/17800
2019 AUA指南：早期睾丸癌的诊断和治疗,"美国泌尿外科学会(AUA,American Urological Association)",有其他版本站内免费下载,https://guide.medlive.cn/guideline/18005
2019 SPA建议：儿童围手术期阿片类药物的应用,"儿科麻醉学会(SPA,Society for Pediatric Anesthesia)",第三方数据库下载,https://guide.medlive.cn/guideline/17790
中国糖尿病足防治指南（2019版）（Ⅱ）,"中华医学会糖尿病学分会(CDS,Chinese Diabetes Society)",有其他版本会员可通过APP阅读,https://guide.medlive.cn/guideline/18026
中国冠状动脉血流储备分数测定技术临床路径专家共识,《中国冠状动脉血流储备分数测定技术临床路径专家共识》专家组,站内免费下载,https://guide.medlive.cn/guideline/17829
急性上呼吸道感染中成药应用专家共识,世界中医药学会联合会,站内免费下载,https://guide.medlive.cn/guideline/18584
人类免疫缺陷病毒/艾滋病患者合并非结核分枝杆菌感染诊治专家共识,中华医学会热带病与寄生虫学分会,站内免费下载,https://guide.medlive.cn/guideline/18270
临床标本溶血检测与检验结果报告专家共识,中国医师协会检验医师分会,站内免费下载,https://guide.medlive.cn/guideline/18195
中国碳青霉烯耐药革兰阴性杆菌(CRO) 感染预防与控制技术指引,"中华预防医学会(CPMA,Chinese Preventive Medicine Association)",有解读站内免费下载,https://guide.medlive.cn/guideline/18178
酮咯酸镇痛专家共识,中国临床麻醉/疼痛相关专家组（统称）,站内免费下载,https://guide.medlive.cn/guideline/18058
急性非静脉曲张性上消化道出血诊治指南（2018年，杭州）,《中华内科杂志》编辑委员,有其他版本会员可通过APP阅读,https://guide.medlive.cn/guideline/17862
糖脂代谢病( 瘅浊) 中西医结合诊疗技术规范,世界中医药学会联合会,有其他版本站内免费下载,https://guide.medlive.cn/guideline/17846
糖尿病足介入综合诊治临床指南（第五版）,中国糖尿病足细胞与介入治疗技术联盟,有解读有其他版本站内免费下载,https://guide.medlive.cn/guideline/17844
尿道损伤诊疗安全共识,中国医促会泌尿健康促进分会,站内免费下载,https://guide.medlive.cn/guideline/17842
特殊健康状态儿童预防接种专家共识之十五—自身免疫性疾病与预防接种,上海市疾病预防控制中心,有其他版本站内免费下载,https://guide.medlive.cn/guideline/17836
二甲双胍临床应用专家共识（2018年版）,中国内分泌相关专家小组（统称）,有其他版本站内免费下载,https://guide.medlive.cn/guideline/17820
特殊健康状态儿童预防接种专家共识之十二—感染性疾病与预防接种,杭州市疾病预防控制中心,有其他版本站内免费下载,https://guide.medlive.cn/guideline/17813
中国儿童钙营养专家共识（2019年版）,"中华预防医学会(CPMA,Chinese Preventive Medicine Association)",站内免费下载,https://guide.medlive.cn/guideline/17902
疱疹性咽峡炎诊断及治疗专家共识（2019年版）,中华医学会儿科学分会感染学组,有解读会员可通过APP阅读,https://guide.medlive.cn/guideline/17924
儿童过敏性疾病诊断及治疗专家共识,《中华儿科杂志》编辑委员会,会员可通过APP阅读,https://guide.medlive.cn/guideline/17921
运动疗法治疗腰痛的专家共识,中国康复医学相关专家组（统称）,站内免费下载,https://guide.medlive.cn/guideline/17863
2019年欧洲泌尿外科协会指南（合集）,"欧洲泌尿外科学会(EAU,European Association of Urology)",有其他版本站内免费下载,https://guide.medlive.cn/guideline/18649
2019 EAU指南：上尿路尿路上皮癌,"欧洲泌尿外科学会(EAU,European Association of Urology)",有其他版本站内免费下载,https://guide.medlive.cn/guideline/18668
2019 EAU指南：肌层浸润和转移性膀胱癌,"欧洲泌尿外科学会(EAU,European Association of Urology)",有其他版本站内免费下载,https://guide.medlive.cn/guideline/18673
2018 JCS指南：急性冠脉综合征的诊断和治疗,"日本循环学会(JCS,Japanese Circulation Society)",站内免费下载,https://guide.medlive.cn/guideline/17809
2019 EULAR建议：系统性红斑狼疮的管理（更新版）,"欧洲抗风湿病联盟(EULAR,The European League Against Rheumatism)",有解读有其他版本站内免费下载,https://guide.medlive.cn/guideline/17784
2019 AHCDO共识声明：妊娠期遗传性出血性疾病的管理（更新）,"澳大利亚血友病中心理事组(AHCDO,Australian Haemophilia Centre Directors’ Organisation)",第三方数据库下载,https://guide.medlive.cn/guideline/17781
2019 SFPT/SFAR指南：优化重症患者β-内酰胺类抗生素治疗,"法国药理学和治疗学学会(SFPT,French Society of Pharmacology and Therapeutics)",站内免费下载,https://guide.medlive.cn/guideline/18375
2018 国际共识声明：机器人肝切除术,国际机器人肝切除专家小组,站内免费下载,https://guide.medlive.cn/guideline/17835
中国热射病诊断与治疗专家共识,全军热射病防治专家组,有其他版本站内免费下载,https://guide.medlive.cn/guideline/17886
2019 NICE指南：肺癌的诊断和管理（NG.122）,"英国国家卫生与临床优化研究所 (NICE,National Institute for Health and Clinical Excellence)",有其他版本站内免费下载,https://guide.medlive.cn/guideline/17763
2019 曼彻斯特国际共识组建议：林奇综合征妇科肿瘤的管理,国外肿瘤科相关专家小组（统称）,有解读站内免费下载,https://guide.medlive.cn/guideline/17817
2019 PANLAR共识声明：生物仿制药,"泛美抗风湿联盟(PANLAR,Pan2American League Against Rheumatism)",站内免费下载,https://guide.medlive.cn/guideline/17766
2019 ESPR声明：极早期发病的炎症性肠病的影像学检查,"欧洲儿科放射学会(ESPR,European Society of Paediatric Radiology)",站内免费下载,https://guide.medlive.cn/guideline/17767
2019 AHA科学声明：无阻塞性冠状动脉疾病心肌梗死患者的诊断和管理,"美国心脏协会(AHA,American Heart Association)",有解读站内免费下载,https://guide.medlive.cn/guideline/17765
2019 欧洲指南：严重创伤出血和凝血障碍的管理（第5版）,创伤出血高级处理特别工作小组,有解读有翻译有其他版本站内免费下载,https://guide.medlive.cn/guideline/17779
2019 意大利共识声明：甲状腺良性结节的微创治疗,国外普通外科相关专家组（统称）,站内免费下载,https://guide.medlive.cn/guideline/17757
2019 AST指南：实体器官移植受者腹泻的管理,"美国移植学会(AST,American Society of Transplantation)",站内免费下载,https://guide.medlive.cn/guideline/17768
2019 ACOG实践简报：大便失禁（No.210）,"美国妇产科医师学会(ACOG,American College of Obstetricians and Gynecologists)",站内免费下载,https://guide.medlive.cn/guideline/17770
2019 ESPR声明：骨龄测定实际年龄,"欧洲儿科放射学会(ESPR,European Society of Paediatric Radiology)",站内免费下载,https://guide.medlive.cn/guideline/17769
2019 CFF共识指南：囊性纤维化患者肺移植推荐,"囊性纤维化基金会(CFF,cystic fibrosis foundation)",站内免费下载,https://guide.medlive.cn/guideline/17776
2019 EASL临床实践指南：药物性肝损伤,"欧洲肝脏研究学会(EASL,European Association for the Study of the Liver)",有解读有翻译站内免费下载,https://guide.medlive.cn/guideline/17778
2019 SIR多学科立场声明：前列腺动脉栓塞治疗良性前列腺增生引起的下尿路症状,"介入放射学会(SIR,Society of Interventional Radiology)",有其他版本站内免费下载,https://guide.medlive.cn/guideline/17782
2019 SEIMC共识文件：血液恶性肿瘤患者发热性中性粒细胞减少症的管理（概要）,"西班牙临床微生物和传染病学会(SEIMC,Spanish Society of Clinical Microbiologyand Infectious Diseases)",站内免费下载,https://guide.medlive.cn/guideline/17780
2019 BSGE/RCOG 循证指南：妊娠期腹腔镜手术,"英国妇科内镜学会(BSGE,British Society for Gynaecological Endoscopy)",有解读站内免费下载,https://guide.medlive.cn/guideline/19257
中国公民逝世后器官捐献流程和规范（2019版）,中华医学会器官移植学分会,站内免费下载,https://guide.medlive.cn/guideline/17771
器官移植受者EB病毒感染和移植后淋巴组织增生性疾病临床诊疗规范（2019版）,中华医学会器官移植学分会,有其他版本站内免费下载,https://guide.medlive.cn/guideline/17762
原发性骨质疏松症社区诊疗指导原则,《原发性骨质疏松症诊疗社区指导原则》编写组,站内免费下载,https://guide.medlive.cn/guideline/17761
甲状腺及相关颈部淋巴结超声若干临床常见问题专家共识（2018版）,中国超声医学工程学会,站内免费下载,https://guide.medlive.cn/guideline/17756
肾综合征出血热诊疗陕西省专家共识,陕西省卫生和计划生育委员会,有其他版本站内免费下载,https://guide.medlive.cn/guideline/17743
中国高龄不孕女性辅助生殖临床实践指南,中华医学会生殖医学分会,有解读有其他版本站内免费下载,https://guide.medlive.cn/guideline/18203
2019 TES临床实践指南：女性绝经后骨质疏松症的药物治疗,"美国内分泌学会(TES,The Endocrine Society)",有其他版本站内免费下载,https://guide.medlive.cn/guideline/17740
2019 WFSBP共识：精神病学中基于血液生物标志物的标准化收集指南,"世界生物精神病学会联合会(WFSBP,World Federation of Societies of Biological Psychiatry)",第三方数据库下载,https://guide.medlive.cn/guideline/17744
2019 香港肾脏服务临床实践指南：普通肾脏病学,"香港肾脏病学会(HKSN,Hong Kong Society of Nephrology)",站内免费下载,https://guide.medlive.cn/guideline/17764
2019 TES临床实践指南：老年糖尿病的治疗,"美国内分泌学会(TES,The Endocrine Society)",站内免费下载,https://guide.medlive.cn/guideline/17732
中国实体器官移植受者血脂管理规范（2019 版）,中华医学会器官移植学分会,站内免费下载,https://guide.medlive.cn/guideline/17747
2017 日本临床实践指南：骶尾部畸胎瘤,"日本儿科学会(JPS,Japan Pediatric Society)",站内免费下载,https://guide.medlive.cn/guideline/17734
2019 EAST实践指南：成人急性阑尾炎的管理,"美国东部创伤外科学会(EAST,The Eastern Association for the Surgery of Trauma)",站内免费下载,https://guide.medlive.cn/guideline/17746
液相色谱串联质谱临床检测方法的开发与验证,中国医师协会检验医师分会,站内免费下载,https://guide.medlive.cn/guideline/17892
2018 外科共识指南：口腔癌患者前哨淋巴结活检,国外肿瘤科相关专家小组（统称）,站内免费下载,https://guide.medlive.cn/guideline/17728
2019 IDSA临床实践指南：无症状细菌尿的管理（更新版）,"美国感染病学会(IDSA,Infectious Diseases Society of America)",站内免费下载,https://guide.medlive.cn/guideline/17727
2018 EULAR建议：支持巨细胞动脉炎观察研究及临床护理的核心数据集,"欧洲抗风湿病联盟(EULAR,The European League Against Rheumatism)",站内免费下载,https://guide.medlive.cn/guideline/17729
2017 国际建议：急性缺血性脑卒中干预的实践标准,国外神经内科相关专家小组（统称）,站内免费下载,https://guide.medlive.cn/guideline/17730
2018 KSSO指南：肥胖的管理,"韩国肥胖研究学会(KSSO,Korean Society for the Study of Obesity)",有其他版本站内免费下载,https://guide.medlive.cn/guideline/18077
儿童过敏性鼻炎诊疗—临床实践指南,中国医师协会儿科医师分会儿童耳鼻咽喉专业委员会,有解读站内免费下载,https://guide.medlive.cn/guideline/17804
2019 CFAS临床实践指南：辅助生殖中子宫内膜薄的管理,"加拿大生殖与男科学会(CFAS,Canadian Fertility and Andrology Society)",站内免费下载,https://guide.medlive.cn/guideline/17970
骨科常见疼痛管理临床实践指南（2018版）,中国骨科相关专家小组（统称）,站内免费下载,https://guide.medlive.cn/guideline/17917
2019 KES立场声明：生长抑素类似物治疗肢端肥大症,"韩国内分泌学会(KES,Korean Endocrine Society)",站内免费下载,https://guide.medlive.cn/guideline/17760
器官移植受者巨细胞病毒感染临床诊疗规范（2019版）,中华医学会器官移植学分会,有其他版本站内免费下载,https://guide.medlive.cn/guideline/17739
2018 KSThR共识声明：甲状腺结节乙醇消融治疗,"韩国甲状腺放射学会(KSThR,Korean Society of Thyroid Radiology)",站内免费下载,https://guide.medlive.cn/guideline/17711
2019 SOGC临床实践指南：硫酸镁对胎儿的神经保护作用（No.376）,"加拿大妇产科医生协会(SOGC,Society of Obstetricians and Gynaecologists of Canada)",有解读有其他版本站内免费下载,https://guide.medlive.cn/guideline/17715
2018 ABM临床方案#30：哺乳期女性乳房肿块、乳房疾病以及乳腺诊断性影像检查,"母乳喂养医学会(ABM,Academy of Breastfeeding Medicine)",站内免费下载,https://guide.medlive.cn/guideline/17748
2019 单纯中药或联合抗生素治疗脓毒症临床实践指南—英文版,中医相关专家组（统称）,第三方数据库下载,https://guide.medlive.cn/guideline/17984
2019 共识声明：骨转换标志物用于亚太地区骨质疏松症治疗短期监测,亚太地区骨科专家小组（统称）,站内免费下载,https://guide.medlive.cn/guideline/17955
2019 NATA指南：新生儿和儿童心脏手术患者血液管理,"患者血液管理、止血和血栓进展网络(NATA,Network for the Advancement of Patient Blood Management， Haemostasis and Thrombosis)",站内免费下载,https://guide.medlive.cn/guideline/18042
2018 韩国实践指南：胃癌,"韩国胃癌协会(KGCA,Korean Gastric Cancer Association)",有其他版本站内免费下载,https://guide.medlive.cn/guideline/17823
2019 AST指南：实体器官移植受者侵袭性曲霉菌病,"美国移植学会(AST,American Society of Transplantation)",有其他版本站内免费下载,https://guide.medlive.cn/guideline/26161
2018 CSCO临床指南：胃癌的诊断和治疗（英文版）,"中国临床肿瘤学会(CSCO,Chinese Society of Clinical Oncology)",有其他版本站内免费下载,https://guide.medlive.cn/guideline/17708
2019 EHRA共识：无症状心律失常的管理,"欧洲心律学会(EHRA,European Heart Rhythm Association)",有解读站内免费下载,https://guide.medlive.cn/guideline/17697
2019 ACC/AHA指南：心血管疾病的一级预防,"美国心脏病学会(ACC,American College of Cardiology)",有解读站内免费下载,https://guide.medlive.cn/guideline/17680
2019 欧洲共识建议：免疫球蛋白A血管炎的诊断和治疗,国外风湿免疫科相关专家小组,站内免费下载,https://guide.medlive.cn/guideline/17692
特殊健康状态儿童预防接种专家共识之十四—IgA血管炎与预防接种,上海市疾病预防控制中心,有其他版本站内免费下载,https://guide.medlive.cn/guideline/17837
2018 临床指南：韩国HIV感染者HIV/AIDS的诊断和治疗,韩国艾滋病学会(Korean Society for AIDS),有其他版本站内免费下载,https://guide.medlive.cn/guideline/17825
会阴切开及会阴裂伤修复技术与缝合材料选择指南（2019）,中国妇幼保健协会助产士分会,站内免费下载,https://guide.medlive.cn/guideline/17943
中国实体器官移植术后高血压诊疗规范（2019版）,中华医学会器官移植学分会,站内免费下载,https://guide.medlive.cn/guideline/17733
2019 AAEP共识声明：急诊室儿童青少年激越的评估和治疗,"美国急诊精神病学协会(AAEP,American Association for Emergency Psychiatry)",站内免费下载,https://guide.medlive.cn/guideline/17701
生酮饮食干预2型糖尿病中国专家共识（2019年版）,中国内分泌相关专家小组（统称）,站内免费下载,https://guide.medlive.cn/guideline/17699
2019 ERAS指南：妇产科/肿瘤科围术期管理,"促进术后恢复学会(ERAS,The Enhanced Recovery After Surgery Society)",有解读有其他版本站内免费下载,https://guide.medlive.cn/guideline/17681
2018 BHIVA指南：妊娠和产后HIV的管理,"英国艾滋病协会(BHIVA,British HIV Association)",第三方数据库下载,https://guide.medlive.cn/guideline/17682
2019 专家共识：腿长不一致儿童的随访建议,国外儿科相关医学专家组（统称）,第三方数据库下载,https://guide.medlive.cn/guideline/17694
